Filename,Original Text,Transcribed Text,WER,CER,MER,WIL,WIP
task_1_level_7_clean_266.wav,And even that is not a very enviable fate.,an even that is not a very enviable fate,0.111111111,0.03030303,0.111111111,0.209876543,0.790123457
task_1_level_7_clean_267.wav,"She watched him fill for her the alcohol lamp, and when he had lighted it and had taken his hat to go, she jumped up and clung to him in silence.",she watched him fill for her the alcohol lamp and when he had lighted it ind had taken his hat to go she jumped up and clung to him in silence,0.032258065,0.008928571,0.032258065,0.063475546,0.936524454
task_1_level_7_clean_268.wav,My doubts were about the propriety.,my doubts were about the popriety,0.166666667,0.034482759,0.166666667,0.305555556,0.694444444
task_1_level_7_clean_269.wav,"It must have been awfully funny, he said.",it must have been awfully funny he said,0,0,0,0,1
task_1_level_7_clean_270.wav,My conviction is that the mood in which the continuation of his story would appear sympathetic is very rare.,my conviction is that the mood in which the continuation of his story would appear sympathetic his very rare,0.052631579,0.011235955,0.052631579,0.102493075,0.897506925
task_1_level_7_clean_271.wav,"Well, I am glad she is gone to settle in Ireland.",well i am glad she is gone to settle miland,0.181818182,0.108108108,0.181818182,0.263636364,0.736363636
task_1_level_7_clean_272.wav,"Yes, I think I see it now, he said after some time, brightening in a quite transitory manner.",yes i think i see it now he said after some time brightening in a quite transatory manner,0.055555556,0.013888889,0.055555556,0.108024691,0.891975309
task_1_level_7_clean_273.wav,The carriage stopped at the Rectory.,the carriage stopped at the rectory,0,0,0,0,1
task_1_level_7_clean_274.wav,Question and answer were asked and given just now.,question an answer were asked and given just now,0.111111111,0.024390244,0.111111111,0.209876543,0.790123457
task_1_level_7_clean_275.wav,So much the better for you!,so much the betterfor you,0.333333333,0,0.333333333,0.466666667,0.533333333
task_1_level_7_clean_276.wav,He was white to the lips.,he was white to the lifs,0.166666667,0.052631579,0.166666667,0.305555556,0.694444444
task_1_level_7_clean_277.wav,"Married women, you know, may be safely authorised.",married women no may be safely authorized,0.25,0.125,0.25,0.357142857,0.642857143
task_1_level_7_clean_278.wav,"The rebounding, dancing hail hung in a little cloud over the machine, and drove along the ground like smoke.",the rebounding dancing hail hung in a little cloud oper le shene and drove along the ground like smoke,0.157894737,0.08045977,0.157894737,0.290858726,0.709141274
task_1_level_7_clean_279.wav,At the sound of his voice she broke into a harsh rumbling which he recognized as an attempt to purr.,at the sound of his voice she broke into a harsh rumbling which he recognized as an attempt to pur,0.05,0.0125,0.05,0.0975,0.9025
task_1_level_7_clean_280.wav,"Well, you sound tired, as if something has worried you.",well you sound tired as if something is worried you,0.1,0.046511628,0.1,0.19,0.81
task_1_level_7_clean_281.wav,The talk ranged wholesomely from family to national affairs.,the top rained holesomely from family te national affairs,0.444444444,0.137254902,0.444444444,0.691358025,0.308641975
task_1_level_7_clean_282.wav,"May I rise up and go away, or will thy servant tear me to pieces?",they i rise up and go away or will thy servant tear me to pieces,0.066666667,0.06122449,0.066666667,0.128888889,0.871111111
task_1_level_7_clean_283.wav,All this in a sympathetic voice and in his unmoved manner.,all this in as sympathetic voice and in his unmoot manner,0.181818182,0.085106383,0.181818182,0.330578512,0.669421488
task_1_level_7_clean_284.wav,But he was not on the boulevard.,it he was not on the boolofbard,0.285714286,0.24,0.285714286,0.489795918,0.510204082
task_1_level_7_clean_285.wav,"His dark, handsome face drooped mournfully towards her to catch her reply.",his dark handsome face dreoped mournfully towards her to catch her reply,0.083333333,0.016393443,0.083333333,0.159722222,0.840277778
task_1_level_7_clean_286.wav,Feet in the jungle that leave no mark!,feed in the jungle that leave no mark,0.125,0.033333333,0.125,0.234375,0.765625
task_1_level_7_clean_287.wav,"It gets too dark, she said hopelessly.",be gets too dark she said hopelessly,0.142857143,0.066666667,0.142857143,0.265306122,0.734693878
task_1_level_7_clean_288.wav,"Yes, she replied indifferently, I know.",yes she replied in differently i know,0.333333333,0,0.285714286,0.404761905,0.595238095
task_1_level_7_clean_289.wav,What had he to offer her?,what had he to also heard,0.333333333,0.368421053,0.333333333,0.555555556,0.444444444
task_1_level_7_clean_290.wav,"she said, putting her lips to the little woolly head.",she said putting her lips to the little wolly head,0.1,0.023809524,0.1,0.19,0.81
task_1_level_7_clean_291.wav,"We must look to her one fault, and remember that she had done a wrong thing in consenting to the engagement, to bear that she should have been in such a state of punishment.",we must look to her one fault and remember that she had done a wong thing in consenting to be engagement to bear that she should have been in such a state of punishment,0.058823529,0.02189781,0.058823529,0.114186851,0.885813149
task_1_level_7_clean_292.wav,Its interest in his surroundings remained of a hazy and nightmarish kind for many days together.,its interest in his surroundings remained of a hazy and nightmarish kind fom many days together,0.0625,0.0125,0.0625,0.12109375,0.87890625
task_1_level_7_clean_293.wav,"No, not now, I thank you.",no not now i think,0.333333333,0.235294118,0.333333333,0.466666667,0.533333333
task_1_level_7_clean_294.wav,I was on my feet in an instant peering through the gorse.,i was on my feet in an instant peering through the corse,0.083333333,0.022222222,0.083333333,0.159722222,0.840277778
task_1_level_7_clean_295.wav,"He said, It is as safe there as it is in our own house.",he said it is a safe there as it is  or own house,0.214285714,0.1,0.214285714,0.335164835,0.664835165
task_1_level_7_clean_296.wav,calls me the child of good fortune., calse me the child os good fortune,0.285714286,0.107142857,0.285714286,0.489795918,0.510204082
task_1_level_7_clean_297.wav,"Then I sniffed good wholesome meat, and opened the door on you.",then i snifped good holesome neap and open the door on you,0.333333333,0.12,0.333333333,0.555555556,0.444444444
task_1_level_7_clean_298.wav,The tension of these last hard moments relaxed.,thattention of these last hard moments relaxed,0.25,0.076923077,0.25,0.357142857,0.642857143
task_1_level_7_clean_299.wav,"I was restless, I could not sleep.",i was restless i could not sleep,0,0,0,0,1
task_1_level_7_clean_300.wav,"We will throw them away, she said in a quiet voice.",we will throw them away she said in a quiet voice,0,0,0,0,1
task_1_level_7_clean_301.wav,"I can only tell you that, to me, hers is the one face which is visible in my darkness.",i can only tell you that to me hers as the one face which is visible in my darkness,0.052631579,0.015384615,0.052631579,0.102493075,0.897506925
task_1_level_7_clean_302.wav,Gardiner said something about it just now.,gardner said something about it just now,0.142857143,0.028571429,0.142857143,0.265306122,0.734693878
task_1_level_7_clean_303.wav,But the core I will not eat!,but the core i will not eat,0,0,0,0,1
task_1_level_7_clean_304.wav,And I paid four cents for you.,and i paid four sents for you,0.142857143,0.043478261,0.142857143,0.265306122,0.734693878
task_1_level_7_clean_305.wav,What do you think of it?,what do you think of it,0,0,0,0,1
task_1_level_7_clean_306.wav,"Nobody could nurse her, as we should do.",nobody could nurse her as we should do,0,0,0,0,1
task_1_level_7_clean_307.wav,I am amazed that you should think of such a thing.,i am amazed that you should think of such a thing,0,0,0,0,1
task_1_level_7_clean_308.wav,He gave me at this the longest and strangest look.,he gave me at this the longest in strangest look,0.1,0.05,0.1,0.19,0.81
task_1_level_7_clean_309.wav,"said the Fox, and he began to laugh out loud.",said the flofs and he begans laugh outlound,0.5,0.176470588,0.5,0.6875,0.3125
task_1_level_7_clean_310.wav,And he turned to her a boyish face stern with pain.,and he turned to her a boyish face stern with pain,0,0,0,0,1
task_1_level_7_clean_311.wav,All eyes were turned on me.,oh eyes wereturned on me,0.5,0.142857143,0.5,0.7,0.3
task_1_level_7_clean_312.wav,He had thrown something into the stream.,he had thrown something into the stream,0,0,0,0,1
task_1_level_7_clean_313.wav,"Dearest, he said, how soon will they all go?",ferest he said how soon will they all go,0.111111111,0.060606061,0.111111111,0.209876543,0.790123457
task_1_level_7_clean_314.wav,The question had come into my mind abruptly were these creatures fools?,the question had come into my mind abruptly were these creatures fels,0.083333333,0.033898305,0.083333333,0.159722222,0.840277778
task_1_level_7_clean_315.wav,After a full half hour the door opened.,after a sel has our the door hopin,0.5,0.322580645,0.5,0.75,0.25
task_1_level_7_clean_316.wav,"But things are so difficult, I sometimes think.",te things are so difficult i sometimes think,0.125,0.078947368,0.125,0.234375,0.765625
task_1_level_7_clean_317.wav,"The man sat up, yelling with fear.",the man sat up yelling with fear,0,0,0,0,1
task_1_level_7_clean_318.wav,The sea is calm and the night is as bright as day.,the sea is calm and the night is as bright as day,0,0,0,0,1
task_1_level_7_clean_319.wav,That evening I strolled into one of them.,that evening i strolled into one of them,0,0,0,0,1
task_1_level_7_clean_320.wav,"The words, too, had become strange.",the words too had become strange,0,0,0,0,1
task_1_level_7_clean_321.wav,And then I remembered that strange terror of the dark., then i remembered that strange terror of the dark,0.1,0.068181818,0.1,0.1,0.9
task_1_level_7_clean_322.wav,"In fact, I am not certain you would wait for an express.",in fact i am not certainly the way for an express,0.333333333,0.23255814,0.333333333,0.515151515,0.484848485
task_1_level_7_clean_323.wav,He walked up to me and took the knife from my hand.,he walked up to me and took the nife from my hand,0.083333333,0.025641026,0.083333333,0.159722222,0.840277778
task_1_level_7_clean_324.wav,"Even though a boy may be very unhappy, he very seldom loses sleep over his worries.",even though a boy may be very unhappy he very seldom lose a sleep over his words,0.1875,0.060606061,0.176470588,0.279411765,0.720588235
task_1_level_7_clean_325.wav,But be careful not to get into mischief again.,but be careful not to get into mischief again,0,0,0,0,1
task_1_level_7_clean_326.wav,and fell senseless to the ground.,and fell sinseless to the ground,0.166666667,0.037037037,0.166666667,0.305555556,0.694444444
task_1_level_7_clean_327.wav,Then make my boy think like us.,then make my boy think like us,0,0,0,0,1
task_1_level_7_clean_328.wav,"From now on, said the man, horrified, I swear I shall never again taste fish.",from now an said the man or ified i swear i shall never again taste fish,0.2,0.050847458,0.1875,0.295833333,0.704166667
task_1_level_7_clean_329.wav,There is something sacred in it.,there is something sacred in it,0,0,0,0,1
task_1_level_7_clean_330.wav,I felt myself crimson and I covered my face with my hands.,i felt myself crimson a i covered my face with my hands,0.083333333,0.043478261,0.083333333,0.159722222,0.840277778
task_1_level_7_clean_331.wav,"They grow tired of the nuts they pick, and throw them down.",they grow tired of the nutsthey pick and throw them down,0.166666667,0,0.166666667,0.242424242,0.757575758
task_1_level_7_clean_332.wav,And after all who will he be marrying?,and after all who was he be married,0.25,0.2,0.25,0.4375,0.5625
task_1_level_7_clean_333.wav,"He felt so embarrassed and ashamed that he turned quickly, plunged into the sea, and disappeared.",he felt so embarrassed and ashamed that he turned quickly plunged into the sea and disappeared,0,0,0,0,1
task_1_level_7_clean_334.wav,"You had better look about you, and ascertain what you do, and what you mean to do.",you had better look about you and ascertain what you do and what you mean to do,0,0,0,0,1
task_1_level_7_clean_335.wav,Now what do you suppose she meant by that?,now what he supposed she meant by mat,0.444444444,0.242424242,0.444444444,0.652777778,0.347222222
task_1_level_7_clean_336.wav,People who have extensive grounds themselves are always pleased with any thing in the same style.,people who have extensive grounds themselves always pleased with anything in the same style,0.1875,0.037037037,0.1875,0.245535714,0.754464286
task_1_level_7_clean_337.wav,Is it true you are out of money?,is it true you are out of money,0,0,0,0,1
task_1_level_7_clean_338.wav,"So, instead of casting about among the trees for fallen twigs, I began leaping up and dragging down branches.",so instead of casting about among the trees for fallen twigs i began leaping up and dragging down branches,0,0,0,0,1
task_1_level_7_clean_339.wav,So I remember to have heard.,so i remember to have heard,0,0,0,0,1
task_1_level_7_clean_340.wav,Soon he became dizzy and faint.,soon he became duzzy and faint,0.166666667,0.04,0.166666667,0.305555556,0.694444444
task_1_level_7_clean_341.wav,I saw him yesterday standing at the door of his house.,i saw him yesterday standing at the door of his house,0,0,0,0,1
task_1_level_7_clean_342.wav,"I went up slowly to the first floor and met her coming down again, this time carrying a lighted candle.",i went up slowly to the first floor and met her coming down again this time carrying a lighted candle,0,0,0,0,1
task_1_level_7_clean_343.wav,It was my cousin who was distinguished.,it was my cousin who was distinguished,0,0,0,0,1
task_1_level_7_clean_344.wav,And did I know what that extraordinary girl said?,in di i know wat that extraordinary girl said,0.333333333,0.1,0.333333333,0.555555556,0.444444444
task_1_level_7_clean_345.wav,"They are your worst enemies, you know, and they like to make you as unhappy as they can.",they are your worse thenemiesn and they like to make you as unhappy as they can,0.222222222,0.117647059,0.222222222,0.319444444,0.680555556
task_1_level_7_clean_346.wav,"It has no grass, no flowers, no frescoes, no glittering walls of marble or comforting patches of ruddy brick.",it has no grass no flowers no frescoes no glittering walls of marble or comforting patches of runding brick,0.052631579,0.045977011,0.052631579,0.102493075,0.897506925
task_1_level_7_clean_347.wav,"He is younger than I by three years, and still more by temperament.",heis younger than i by three years ind still more by temperamant,0.307692308,0.037735849,0.307692308,0.480769231,0.519230769
task_1_level_7_clean_348.wav,"As the columns of hail grew thinner, I saw the white figure more distinctly.",as the columns of haile grew thinner as saw the white figure more distinctly,0.142857143,0.049180328,0.142857143,0.265306122,0.734693878
task_1_level_7_clean_349.wav,In a moment I was wet to the skin.,in a moment i was wet to the skin,0,0,0,0,1
task_1_level_7_clean_350.wav,She used to dart at one from some dark recesses which I never explored.,she used to dark at one from some dark recesses which i never explored,0.071428571,0.01754386,0.071428571,0.137755102,0.862244898
task_1_level_7_clean_351.wav,And yet you will tell me that the sexes are equal.,and yet you will tell me that the sexes are equal,0,0,0,0,1
task_1_level_7_clean_352.wav,I did not remember when I sent you for him just now.,i did not remember when i seid be for him just now,0.166666667,0.125,0.166666667,0.305555556,0.694444444
task_1_level_7_clean_353.wav,He caught my eye on that spiritedly composed woodcut.,the caught my eye on that spiritedly composed with gun,0.333333333,0.136363636,0.3,0.455555556,0.544444444
task_1_level_7_clean_354.wav,You seem to use them as if they were a sort of formula.,you seemd to use them as if they were a sort of formula,0.076923077,0.023809524,0.076923077,0.147928994,0.852071006
task_1_level_7_clean_355.wav,And large silent tears overflowed and fell upon her hands and upon the lace at her breast.,and large silent tears overflowed and fell upon her hands and upon the lace at her breast,0,0,0,0,1
task_1_level_7_clean_356.wav,I suppose you fellows fight standing on your tails?,i suppose you fellows fight standing on your tails,0,0,0,0,1
task_1_level_7_clean_357.wav,"In time, of course, there will be many.",en time of course there will be many,0.125,0.034482759,0.125,0.234375,0.765625
task_1_level_7_clean_358.wav,"The invitation was refused, and by a verbal message.",the invitation was refused and by a verbal message,0,0,0,0,1
task_1_level_7_clean_359.wav,"I asked, but he only snarled, muttering to the bells jingling on his cap.",i asked but he only snalled muttering to the bells jingling in his can,0.214285714,0.052631579,0.214285714,0.382653061,0.617346939
task_1_level_7_clean_360.wav,"But the fact is that those two display, in every phase of discovery and response, an exact accord.",but the fact is that those two display in every phase of discovering response and exact a cord,0.277777778,0.064102564,0.263157895,0.395061728,0.604938272
task_1_level_7_clean_361.wav,"Certainly you shall go back to school, I said, if it be that that troubles you.",certainly he shall go back to school i said if it be that that trouble you,0.125,0.06557377,0.125,0.234375,0.765625
task_1_level_7_clean_362.wav,"Wilt thou still keep him, Mother?",wole thou still keep him mother,0.166666667,0.076923077,0.166666667,0.305555556,0.694444444
task_1_level_7_clean_363.wav,If I once start to tell you I would want you to feel that you have been there yourself.,if i once started t tell me i would want you to feel that you have been there yourself,0.157894737,0.088235294,0.157894737,0.290858726,0.709141274
task_1_level_7_clean_364.wav,"None of you are asked to perform, but local celebrities are.",none if you are asked to perform but local celebrities are,0.090909091,0.020833333,0.090909091,0.173553719,0.826446281
task_1_level_7_clean_365.wav,"No, it was long enough, broad enough, handsome enough.",no it was  long enough broad enough handsome enough,0,0,0,0,1
task_1_level_7_clean_366.wav,"I was not afraid, but my head swam a little and I only looked at him mutely.",i was not afraid but my head swam a little and i only looked at him meatly,0.058823529,0.051724138,0.058823529,0.114186851,0.885813149
task_1_level_7_clean_367.wav,"It was a blustering day, and the wind had taken and broken the dahlias.",it was a blustering day and the winded taken and broken the dowes,0.214285714,0.125,0.214285714,0.335164835,0.664835165
task_1_level_7_clean_368.wav,From your tone one might think you yearned to cut it off.,from your tone one might think you yearne to cut it off,0.083333333,0.022222222,0.083333333,0.159722222,0.840277778
task_1_level_7_clean_369.wav,I listened and then tried to call.,i listened and then tried to clall,0.142857143,0.037037037,0.142857143,0.265306122,0.734693878
task_1_level_7_clean_370.wav,"he asked, looking up, as she paused.",he asked looking up as she paused,0,0,0,0,1
task_1_level_7_clean_371.wav,"I had not yet reduced him to quite so vulgar a lie, and I felt proportionately ashamed.",i had not yet reduced him to quite so vulgar alive and i felt tro portion of lhy ashaned,0.411764706,0.101449275,0.35,0.476780186,0.523219814
task_1_level_7_clean_372.wav,"They stared at each other innocently, on the brink of fresh laughter.",they stared at each other innocently on the brink of fresh laughter,0,0,0,0,1
task_1_level_7_clean_373.wav,His profile might have been a beautiful carving in white ivory.,his profile might have been a beautiful carving in white eyesry,0.090909091,0.076923077,0.090909091,0.173553719,0.826446281
task_1_level_7_clean_374.wav,he asked when they were driving home.,he asked when they were driving hom,0.142857143,0.033333333,0.142857143,0.265306122,0.734693878
task_1_level_7_clean_375.wav,That look is for one man alone.,that look is for one man alone,0,0,0,0,1
task_1_level_7_clean_376.wav,For some reason or other this last statement of hers brought me immense comfort.,for some reason or other this last statement of hers brought me an mense comfort,0.142857143,0.03030303,0.133333333,0.195238095,0.804761905
task_1_level_7_clean_377.wav,"she said to herself, in the sunshiny silence of the breakfast room.",she said to myrself in the sunshiny silence of the breakfast room,0.083333333,0.037037037,0.083333333,0.159722222,0.840277778
task_1_level_7_clean_378.wav,"Feverishly I struggled to put it from me, but I saw the lake of Hali, thin and blank, without a ripple or wind to stir it, and I saw the towers of Carcosa behind the moon.",fevrishly i struggled to put it from me but i saw the lake of hollo nem in blank without a ripple or wind to stirr ing and i saw the towers of carcosa in ilan,0.25,0.167938931,0.25,0.421428571,0.578571429
task_1_level_7_clean_379.wav,She followed the maid into the Rectory.,she followed the maid into the wrectory,0.142857143,0.03125,0.142857143,0.265306122,0.734693878
task_1_level_7_clean_380.wav,"Well, I shall tell his Majesty at the next opportunity, and say you heard it.",well i shall tell his majesty of the next opportunity and say you heard it,0.066666667,0.033333333,0.066666667,0.128888889,0.871111111
task_1_level_7_clean_381.wav,The sea is fond of playing these tricks.,the sea is fond of playing thyse tricks,0.125,0.03125,0.125,0.234375,0.765625
task_1_level_7_clean_382.wav,"No doubt in that perfect world there had been no unemployed problem, no social question left unsolved.",no doubt in that perfect world there had been no unemployed problem no social question left on solid,0.117647059,0.035714286,0.111111111,0.163398693,0.836601307
task_1_level_7_clean_383.wav,But is it not some hoax?,but his id not some hoxs,0.5,0.222222222,0.5,0.75,0.25
task_1_level_7_clean_384.wav,A black shadow dropped down into the circle.,a black shadow dropped down inho the circle,0.125,0.027777778,0.125,0.234375,0.765625
task_1_level_7_clean_385.wav,I know where life has brought you.,i know where life has brought heu,0.142857143,0.074074074,0.142857143,0.265306122,0.734693878
task_1_level_7_clean_386.wav,"If she has it now, you have given it.",if she has it now an you have given me,0.222222222,0.148148148,0.2,0.288888889,0.711111111
task_1_level_7_clean_387.wav,What were the appearances of unhappiness?,what were the appearances of unhappiness,0,0,0,0,1
task_1_level_7_clean_388.wav,It was felt as such things must be felt.,it was felt as such things must be felt,0,0,0,0,1
task_1_level_7_clean_389.wav,"All that could be seen of him was a very small black dot moving swiftly on the blue surface of the water, a little black dot which now and then lifted a leg or an arm in the air.",all that could be seen of him as a very small black dat moving swiftly on the blue surface of the water he little black dod which now an then lifted a leg or an arm and e air,0.179487179,0.065217391,0.179487179,0.326758711,0.673241289
task_1_level_7_clean_390.wav,"she asked, with the slightest tremor of her soft eyelashes.",she asked with ha slightest treml of her soft ie lashes,0.4,0.125,0.363636364,0.554545455,0.445454545
task_1_level_7_clean_391.wav,"With every word urging me to get away, her clasp tightened, she hugged my head closer to her breast.",thi every word urging ly to get away r claspe tightened she hugged my head closer to her breast,0.210526316,0.101265823,0.210526316,0.376731302,0.623268698
task_1_level_7_clean_392.wav,I gather they had a somewhat funny scene.,a gather they had a somewhat funny scene,0.125,0.03030303,0.125,0.234375,0.765625
task_1_level_7_clean_393.wav,"Take him, therefore, and throw him into prison.",take him therefore and throw him into prison,0,0,0,0,1
task_1_level_7_clean_394.wav,It was a pity that she had not come back earlier!,it was a pity that she had not come back earlier,0,0,0,0,1
task_1_level_7_clean_395.wav,"She hesitated, and laughed a little laugh of pure pleasure.",she hesitated and laughed the little laugh of pure pleasure,0.1,0.0625,0.1,0.19,0.81
task_1_level_7_clean_396.wav,She exclaimed How very odd of him!,she exclaimed how very oddif hir,0.428571429,0.074074074,0.428571429,0.619047619,0.380952381
task_1_level_7_clean_397.wav,I for one will help her to go to Greece.,my fo one who felt per to go to greece,0.5,0.3,0.5,0.75,0.25
task_1_level_7_clean_398.wav,We watched the reptile moving slowly over the smooth rock to where the sunlight fell in a broad warm patch.,ye watched the reptile moving slowly over the smooth rock towhere the sunlight fell an abroad morm patch,0.35,0.045977011,0.35,0.530555556,0.469444444
task_1_level_7_clean_399.wav,"He looked across at the Editor, who was a rare visitor, and hoped he was all right.",he looked across the editor whe was a ramed hisitor and hoped we was all right,0.294117647,0.109375,0.294117647,0.470588235,0.529411765
task_1_level_7_clean_400.wav,"Now, where does he lie up?",now where does he lie up,0,0,0,0,1
task_1_level_7_clean_401.wav,The cub must be shown to the Pack.,the cub must be shown to the pack,0,0,0,0,1
task_1_level_7_clean_402.wav,For something tremendous has happened I must face it without getting muddled.,for something tremendous has happened i must face it without getting muddled,0,0,0,0,1
task_1_level_7_clean_403.wav,"He looked as one who, sightless, has yet been making frantic efforts to see.",he looked as one whose cightless as yet been making frantic efforts to see,0.214285714,0.05,0.214285714,0.382653061,0.617346939
task_1_level_7_clean_404.wav,"Come and sit on the couch all the same, she said after a moment of hesitation.",come andsit on the couch all the same she said after a moment hesitation,0.1875,0.032786885,0.1875,0.245535714,0.754464286
