Filename,Original Text,Transcribed Text,WER,CER,MER,WIL,WIP
task_1_level_7_clean_128.wav,She had taken it into her head that his health was endangered in some way.,she had taken it into her head that his health was en dangered in some way,0.133333333,0,0.125,0.183333333,0.816666667
task_1_level_7_clean_129.wav,"Well, continued the doctor, the other solution remains.",well continued the doctor the other sotution the mains,0.375,0.066666667,0.333333333,0.5,0.5
task_1_level_7_clean_130.wav,When shall I see you again?,when shall i see you again,0,0,0,0,1
task_1_level_7_clean_131.wav,"And now she owed him the truth, the whole, painful, humiliating story.",announc he oden the truth he whole painful humiliating story,0.5,0.181818182,0.5,0.7,0.3
task_1_level_7_clean_132.wav,I ought to be able to keep you two blind people apart.,i ought to be able to keep you too blind people apart,0.083333333,0.023809524,0.083333333,0.159722222,0.840277778
task_1_level_7_clean_133.wav,The little brutes were close upon me.,the little brutes were close upon me,0,0,0,0,1
task_1_level_7_clean_134.wav,"A woman far from common, who died some few years ago.",a woman far from coms who died some few years ago,0.090909091,0.073170732,0.090909091,0.173553719,0.826446281
task_1_level_7_clean_135.wav,"All the world seemed to have sent him letters of sympathy, poor chap.",tan the world seemed to have sent him letters of sympathy poor chap,0.076923077,0.054545455,0.076923077,0.147928994,0.852071006
task_1_level_7_clean_136.wav,Are you taking the place of the watchdog?,are you taking the place of the watch dog,0.25,0,0.222222222,0.319444444,0.680555556
task_1_level_7_clean_137.wav,All at once in the distance a small light flickered.,all at once in the distance a small light flickered,0,0,0,0,1
task_1_level_7_clean_138.wav,I will not say quite all.,iill not say quite on,0.5,0.210526316,0.5,0.7,0.3
task_1_level_7_clean_139.wav,He had such a fearful appearance that one look at him would fill you with horror.,he had such a fearful appearance that one look at him with till you with horror,0.125,0.076923077,0.125,0.234375,0.765625
task_1_level_7_clean_140.wav,I never thought him ugly again.,i never thought him un again,0.166666667,0.12,0.166666667,0.305555556,0.694444444
task_1_level_7_clean_141.wav,She should have tried at the Rectory.,she should have tried at the rectory,0,0,0,0,1
task_1_level_7_clean_142.wav,"The liquid blue in her eyes remained directed at me without any expression except that of its usual mysterious immobility, but all her face took on a sad and thoughtful cast.",the liquid blue in her eyes remained directed at me without any expression except that of its usual imysterious inmobility but all her face took on the sad and thought wot cast,0.161290323,0.056338028,0.15625,0.265120968,0.734879032
task_1_level_7_clean_143.wav,"You see, he said, it is without a flaw.",yo see he said it is without a flock,0.222222222,0.142857143,0.222222222,0.395061728,0.604938272
task_1_level_7_clean_144.wav,And on this spot just now.,and on this spot just now,0,0,0,0,1
task_1_level_7_clean_145.wav,"He had lost the game, truly, but she knew he would play his last card, just the same.",he had lost the game truly but she knew he would play his last card just the same,0,0,0,0,1
task_1_level_7_clean_146.wav,I want to hear the new organ.,i want to hear the new organ,0,0,0,0,1
task_1_level_7_clean_147.wav,"So long as he is away do thou or one of the four brothers sit on that rock, so that I can see thee as I come out of the village.",so long as he is away do nhou o one of the four brothers sit on that rife so that i can see them as i come out of the village,0.129032258,0.0625,0.129032258,0.241415193,0.758584807
task_1_level_7_clean_148.wav,"The son, who took every little contretemps as if it were a tragedy, was listening also.",he son whe took every little contretempts as it it were attragedy as listening also,0.4375,0.086956522,0.4375,0.6625,0.3375
task_1_level_7_clean_149.wav,"The night came like the turning out of a lamp, and in another moment came tomorrow.",the night came like the turning out of he lamp and in another moment tamed to morrow,0.25,0.060606061,0.235294118,0.378676471,0.621323529
task_1_level_7_clean_150.wav,There could be no doubt about him.,there could be no doubt about it,0.142857143,0.074074074,0.142857143,0.265306122,0.734693878
task_1_level_7_clean_151.wav,"Now he is telling all his wisdom to the kites, but he told me everything before I broke his back.",now he is telling all his wisdom to the kites but he told me everything before i broke his back,0,0,0,0,1
task_1_level_7_clean_152.wav,As soon as I had done so I used to say to myself What will they think of that?,as soon as i had done so i used to say to myself what will they think of that,0,0,0,0,1
task_1_level_7_clean_153.wav,"But all the time I had been sitting silent, my face turned toward her.",but all the time i had been sitting silent my face turned toward her,0,0,0,0,1
task_1_level_7_clean_154.wav,His Southern blood makes him very violent sometimes.,his southern blood makes him very violent sometimes,0,0,0,0,1
task_1_level_7_clean_155.wav,"She was then obliged to be finished, and make her appearance.",she was then obliged to be finished and make her appearance,0,0,0,0,1
task_1_level_7_clean_156.wav,"Meanwhile I said over and over to myself, how would it be when life began again for us all?",meanwhile i said over and over to myself how would it be when life began again for asal,0.105263158,0.028169014,0.105263158,0.15497076,0.84502924
task_1_level_7_clean_157.wav,Have you perhaps taught him to speak?,have you perhaps taught him to speak,0,0,0,0,1
task_1_level_7_clean_158.wav,I felt a peculiar shrinking from those pallid bodies.,i felt a peculiar shrinking and those palid bodies,0.222222222,0.113636364,0.222222222,0.395061728,0.604938272
task_1_level_7_clean_159.wav,"When I opened my eyes, I looked around in terror.",when i opened my eyes i looked around and terror,0.1,0.052631579,0.1,0.19,0.81
task_1_level_7_clean_160.wav,I pointed to the Time Machine and to myself.,i pointed to the time machine anto myself,0.222222222,0.028571429,0.222222222,0.319444444,0.680555556
task_1_level_7_clean_161.wav,All nature seemed to hush and listen for the answer.,whol nature seemed to hush and listened for the answer,0.2,0.119047619,0.2,0.36,0.64
task_1_level_7_clean_162.wav,"I warned you about her I begged you, implored you not to, but of course it was not listened to.",i want you about her i begged you amporedo not to  but of course it was not listene to,0.2,0.109589041,0.2,0.326315789,0.673684211
task_1_level_7_clean_163.wav,"When she spoke, it was as if the muscles of her throat were constricted.",when she spoke it was as if the muscles of her throat were constricted,0,0,0,0,1
task_1_level_7_clean_164.wav,"Some said one thing, some another.",some said one thing some onother,0.166666667,0.037037037,0.166666667,0.305555556,0.694444444
task_1_level_7_clean_165.wav,"Within was a small apartment, and on a raised place in the corner of this was the Time Machine.",within was a small apartment and on a raised place in the corner of this as the time wisshing,0.105263158,0.08,0.105263158,0.199445983,0.800554017
task_1_level_7_clean_166.wav,It pleased her to be called names.,it pleased her to be called names,0,0,0,0,1
task_1_level_7_clean_167.wav,Perhaps he did not think he would strike it.,perhaps he did not think he wald strike it,0.111111111,0.057142857,0.111111111,0.209876543,0.790123457
task_1_level_7_clean_168.wav,"Her voice was as usual, pertinacious, unfeeling, with a slight plaint in it terrible in its unchanged purpose.",her voice was as usual perdinacious unfeeling fith a slight plaintin at terrible in its unchanged purpose,0.277777778,0.033707865,0.277777778,0.447712418,0.552287582
task_1_level_7_clean_169.wav,"I can assure you, last night was no pastime.",i can assure you last night was no past time,0.222222222,0.029411765,0.2,0.288888889,0.711111111
task_1_level_7_clean_170.wav,"His mother, too, would be pleased she had counselled the step he must write her a long account.",his mother too would be pleased she had counseled the step he must write her along theccount,0.222222222,0.053333333,0.222222222,0.359477124,0.640522876
task_1_level_7_clean_171.wav,But how can we return to Nature when we have never been with her?,but how can we return to nature when we have never been with her,0,0,0,0,1
task_1_level_7_clean_172.wav,"The handwriting is rather bold and very clear, with no twirls or flourishes.",the handwriting is rather bold an very clear wis no twarls ore flurishes,0.384615385,0.096774194,0.384615385,0.621301775,0.378698225
task_1_level_7_clean_173.wav,"A fourth was scented, followed, outflanked, his retreat towards the door cut off, and finally captured behind the stove.",a fourth was sent i followed out flanked his retreat towards the door cut off and finally captured behind the stove,0.210526316,0.030927835,0.19047619,0.275689223,0.724310777
task_1_level_7_clean_174.wav,But that can be left alone.,the back an be left alone,0.5,0.333333333,0.5,0.75,0.25
task_1_level_7_clean_175.wav,He began trumpeting furiously at the top of his trumpet.,he began trumpeting furiously at the top of his trumpet,0,0,0,0,1
task_1_level_7_clean_176.wav,"As he did so, he heard a hearty burst of laughter close to his head.",as he did so to heard a heardy burst of laughter close to his head,0.133333333,0.057692308,0.133333333,0.248888889,0.751111111
task_1_level_7_clean_177.wav,"Truth to say, I was abashed by the silence which was her only answer to this sally.",truth to say i was a bashed by the silence which was her only answer to the sauny,0.235294118,0.061538462,0.222222222,0.359477124,0.640522876
task_1_level_7_clean_178.wav,"It is I, a poor Tunny swallowed by the Shark at the same time as you.",it is odd the poor tony swallowed by the shark at the same time as you,0.1875,0.153846154,0.1875,0.33984375,0.66015625
task_1_level_7_clean_179.wav,After all it was somebody belonging to me.,after all it was somebody belonging to me,0,0,0,0,1
task_1_level_7_clean_180.wav,He sprang to his feet again.,he sprang to his feet again,0,0,0,0,1
task_1_level_7_clean_181.wav,Always the first person to be thought of!,always the first person to be thought off,0.125,0.03030303,0.125,0.234375,0.765625
task_1_level_7_clean_182.wav,I told you I was packing.,i told you i was packing,0,0,0,0,1
task_1_level_7_clean_183.wav,"The street and the river were dirty yellow, the bridge was dirty grey, and the hills were dirty purple.",the street and the river were dirty yellow the bridge was dirty gray and the hills wedirty purple,0.157894737,0.036585366,0.157894737,0.251461988,0.748538012
task_1_level_7_clean_184.wav,Then in a moment her face fell.,then in a moment her face found,0.142857143,0.166666667,0.142857143,0.265306122,0.734693878
task_1_level_7_clean_185.wav,She clasped her knees for the name.,she clasped her knees for the name,0,0,0,0,1
task_1_level_7_clean_186.wav,The edges of the fur cloak fell apart.,he edges of the firt cloak fell apart,0.25,0.1,0.25,0.4375,0.5625
task_1_level_7_clean_187.wav,"Her breath was behaving badly, and the muscles contracted in her throat, but she managed a smile.",the breath was behaving badly ind the muscles contracted in he throat she managed to smile,0.294117647,0.115384615,0.294117647,0.470588235,0.529411765
task_1_level_7_clean_188.wav,"I still have them in my pocket, except one which I spent at the Inn of the Red Lobster.",i still have them in my pocket except one which i spent to be in o the red lobster,0.210526316,0.074626866,0.210526316,0.376731302,0.623268698
task_1_level_7_clean_189.wav,"In a day or two, I shall cease to notice it.",in a day or two i shall cease to notice it,0,0,0,0,1
task_1_level_7_clean_190.wav,"Dark objects, carried swiftly on the breast of the current, struck with a grinding tearing noise against the stone piers, spun around for an instant, and hurried away into the darkness.",dark objects carried swiftly on the breast of the currentn struck with a grinding teaering noise against the stone piers spon around for an instant and hurried away into the darkpess,0.129032258,0.026666667,0.129032258,0.241415193,0.758584807
task_1_level_7_clean_191.wav,He turned from her and faced up the chancel.,he turned from her and faced up the chancel,0,0,0,0,1
task_1_level_7_clean_192.wav,In this world you must give sparingly.,it miss world you must give sparingly,0.285714286,0.096774194,0.285714286,0.489795918,0.510204082
task_1_level_7_clean_193.wav,"After a while I became impatient and tried to move, but the box was too narrow.",after a while i became impatient and tried to meve tat the box was too narrow,0.125,0.048387097,0.125,0.234375,0.765625
task_1_level_7_clean_194.wav,Now I shall have to work for my mother also.,now i shall have to work for my mother also,0,0,0,0,1
task_1_level_7_clean_195.wav,"Then she told me how she had found it one day while coming from the Aquarium in the Battery, how she had advertised it and watched the papers, but at last gave up all hopes of finding the owner.",then she told me how she had found it one day lone coming from the aquarium and the battery how she had advertised it and watched the papers but at last gave up all hopes of finding te od,0.102564103,0.071895425,0.102564103,0.19460881,0.80539119
task_1_level_7_clean_196.wav,Then I looked about for my clothes.,then i looked about for my clothes,0,0,0,0,1
task_1_level_7_clean_197.wav,"The windows of the church were open, and the massive oaken doors stood ajar.",the windows of the church were open and he massive oaken door stood a jar,0.285714286,0.032786885,0.266666667,0.423809524,0.576190476
task_1_level_7_clean_198.wav,"I was not the one who hit you, you know.",i was not the one who hit you you know,0,0,0,0,1
task_1_level_7_clean_199.wav,"If one of the two was representative, then the other was either something more or less than human.",if one of the two was representedive an the other was either something more reless than human,0.222222222,0.088607595,0.222222222,0.359477124,0.640522876
task_1_level_7_clean_200.wav,"I was not loath to follow their example, for I felt thirsty and hungry.",i was not loathd to follow their example for i felt thirsty and hungry,0.071428571,0.017857143,0.071428571,0.137755102,0.862244898
task_1_level_7_clean_201.wav,"They were like a lot of intellectual dogs, you know...",they were like a lot of intellectual dogs you know,0,0,0,0,1
task_1_level_7_clean_202.wav,The field was full of vines heavy with grapes.,the field is full of fines heavy with grapes,0.222222222,0.081081081,0.222222222,0.395061728,0.604938272
task_1_level_7_clean_203.wav,"But now, she would rather it had not happened.",but now she would rather it had not happened,0,0,0,0,1
task_1_level_7_clean_204.wav,I went out through the portal into the sunlit world again as soon as my hunger was satisfied.,ad went out through the portal into the sun live world again as soon as my hunger was satisfied,0.166666667,0.053333333,0.157894737,0.251461988,0.748538012
task_1_level_7_clean_205.wav,I hesitated only for a moment.,i hesitated only for a moment,0,0,0,0,1
task_1_level_7_clean_206.wav,He is rather a peculiar man.,he is rather peculiar man,0.166666667,0.045454545,0.166666667,0.166666667,0.833333333
task_1_level_7_clean_207.wav,He wanted to see the very ground on which the Principle of Legitimacy was actually asserting itself arms in hand.,he wanted to see the very ground in which the principle of legitimacy was actually asserting itself arms in hand,0.05,0.010752688,0.05,0.0975,0.9025
task_1_level_7_clean_208.wav,I have a horror of myself.,have a horrr of myself,0.333333333,0.1,0.333333333,0.466666667,0.533333333
task_1_level_7_clean_209.wav,He seems to like us young and pretty!,he seems to like us young and pretty,0,0,0,0,1
task_1_level_7_clean_210.wav,"And then when all was satisfactorily settled, we could pack them off home, and be by ourselves again.",and then when all was satisfactorly settled he could tack them off home and be by heurselves again,0.222222222,0.061728395,0.222222222,0.395061728,0.604938272
task_1_level_7_clean_211.wav,But the door came open to my push.,but the door came open to my push,0,0,0,0,1
task_1_level_7_clean_212.wav,We must get to work swiftly.,we must get to work swiftly,0,0,0,0,1
task_1_level_7_clean_213.wav,there is the lovely little church!,there is the lovely little church,0,0,0,0,1
task_1_level_7_clean_214.wav,"The Time Traveller looked at us, and then at the mechanism.",the time traveler looked at us and then at the mechanism,0.090909091,0.021276596,0.090909091,0.173553719,0.826446281
task_1_level_7_clean_215.wav,And how well you told it.,and how well yu told it,0.166666667,0.052631579,0.166666667,0.305555556,0.694444444
task_1_level_7_clean_216.wav,"He caught up the lamp swiftly, and carried it, flaring red, through the door into the corridor.",he caught up the lamp swiftly and carried it flaring red through the door into the cloridor,0.058823529,0.026666667,0.058823529,0.114186851,0.885813149
task_1_level_7_clean_217.wav,"I promise, he said, greatly puzzled.",i promised he said greatly puszite,0.333333333,0.142857143,0.333333333,0.555555556,0.444444444
task_1_level_7_clean_218.wav,I have now a key to all her odd looks and ways.,i have now achieved to all her odds looks and ways,0.25,0.2,0.25,0.386363636,0.613636364
task_1_level_7_clean_219.wav,"You might, for instance, tell me that you were sorry for my tears.",might for instance tell me that you were sorry for my tears,0.076923077,0.058823529,0.076923077,0.076923077,0.923076923
task_1_level_7_clean_220.wav,As you came through the wood I saw that nothing else mattered.,as you came through the wood i saw that nothing else mattered,0,0,0,0,1
task_1_level_7_clean_221.wav,Instantly she shot out a hand towards me.,instantly she shot out a hand towards me,0,0,0,0,1
task_1_level_7_clean_222.wav,His settled purpose was quite other.,his settled purpose was quite other,0,0,0,0,1
task_1_level_7_clean_223.wav,I never knew before how still I could keep.,i never knew before how still i could keep,0,0,0,0,1
task_1_level_7_clean_224.wav,At last came the sound of an opening door.,at last cam the sound of an opening door,0.111111111,0.03030303,0.111111111,0.209876543,0.790123457
task_1_level_7_clean_225.wav,I hope you have pleasant accounts from Windsor?,i hope you have pleasant accounts from windsory,0.125,0.025641026,0.125,0.234375,0.765625
task_1_level_7_clean_226.wav,It was no more than a wish.,it was no more than a wish,0,0,0,0,1
task_1_level_7_clean_227.wav,She looked towards the yellow screen.,she looked towards the yellow screen,0,0,0,0,1
task_1_level_7_clean_228.wav,"You are better placed here very fit for a wife, but not at all for a governess.",you are better placed here very fit for a wife but not at all for a governess,0,0,0,0,1
task_1_level_7_clean_229.wav,"They will stay a good while when they do come, and he will be half his time with us.",they will stay an good while when they do come and he will be half his time with us,0.052631579,0.015625,0.052631579,0.102493075,0.897506925
task_1_level_7_clean_230.wav,I have more than half an expectation of our all going abroad.,i have more than farc en expectation of our all going aboild,0.25,0.142857143,0.25,0.4375,0.5625
task_1_level_7_clean_231.wav,"We are now in communication with ten thousand men, he muttered.",we are now in communication with ten thousand men whe muttered,0.090909091,0.019607843,0.090909091,0.173553719,0.826446281
task_1_level_7_clean_232.wav,With one leap he was out of bed and into his clothes.,with one leap o was out of bed and into his clothes,0.083333333,0.048780488,0.083333333,0.159722222,0.840277778
task_1_level_7_clean_233.wav,"The sky kept very clear, except for a hazy cloud or so.",he sky kept very clear xcept for a hazy cloud or so,0.166666667,0.047619048,0.166666667,0.305555556,0.694444444
task_1_level_7_clean_234.wav,If I could only as easily get rid of my hunger!,if i could only as easily get rid of my hunger,0,0,0,0,1
task_1_level_7_clean_235.wav,I must be a poetess after all.,i must be a poet o after all,0.285714286,0.130434783,0.25,0.357142857,0.642857143
task_1_level_7_clean_236.wav,Give me the paper and listen.,give me the paper and listen,0,0,0,0,1
task_1_level_7_clean_237.wav,"Those words recalled me to myself, exorcised the evil spirit by the mere enchanting power of the voice.",those words recalled me to myself exercise of evil spirit by the near in chanting power before is,0.444444444,0.202380952,0.421052632,0.62654321,0.37345679
task_1_level_7_clean_238.wav,Because that feather pillow on my feet bothers me.,because that feather pelloon my see bothers me,0.333333333,0.097560976,0.333333333,0.5,0.5
task_1_level_7_clean_239.wav,I still think it is the most plausible one.,i still think it is the most plausible one,0,0,0,0,1
task_1_level_7_clean_240.wav,I have been to confession last evening.,i have been to confession last evening,0,0,0,0,1
task_1_level_7_clean_241.wav,But at the back of his brain there lurked a dim mistrust.,but at the back of his brain theire lurked and dim mistrust,0.166666667,0.066666667,0.166666667,0.305555556,0.694444444
task_1_level_7_clean_242.wav,What a bear you must have thought me.,would ave bear you must have thought me,0.25,0.206896552,0.25,0.4375,0.5625
task_1_level_7_clean_243.wav,In the morning they left for Rome.,in the morning they left her rome,0.142857143,0.074074074,0.142857143,0.265306122,0.734693878
task_1_level_7_clean_244.wav,Where shall we find a safe place for gentlemen like ourselves?,when shall we find the safe place for gentleman like ourselves,0.272727273,0.117647059,0.272727273,0.47107438,0.52892562
task_1_level_7_clean_245.wav,It never occurred to him to turn his head.,id never occurred to him to turn his head,0.111111111,0.03030303,0.111111111,0.209876543,0.790123457
task_1_level_7_clean_246.wav,She got into the victoria and placed herself with her back to the horse.,she got into the victoria and placed herself with her back to the horse,0,0,0,0,1
task_1_level_7_clean_247.wav,"She pushed the door further open, and went in.",she pushed the door further open and went in,0,0,0,0,1
task_1_level_7_clean_248.wav,What a nuisance that I have to go to school!,what i lusance that i have to go to school,0.2,0.088235294,0.2,0.36,0.64
task_1_level_7_clean_249.wav,They are the bites of wolves.,they are the bites of woivs,0.166666667,0.086956522,0.166666667,0.305555556,0.694444444
task_1_level_7_clean_250.wav,The event had every promise of happiness for her friend.,the edvent had every promise of happiness for her friend,0.1,0.02173913,0.1,0.19,0.81
task_1_level_7_clean_251.wav,"I never read one more to the purpose, certainly.",i never read one more to the purpose f certain,0.222222222,0.078947368,0.2,0.288888889,0.711111111
task_1_level_7_clean_252.wav,"All mysteries were explained all joys experienced and the smile on her calm lips, bespoke ineffable content.",all mysteries were explained all joys experienced ind the smile on her calm lips fespoke ineffable content,0.117647059,0.022222222,0.117647059,0.221453287,0.778546713
task_1_level_7_clean_253.wav,"In the storm of last night, answered the Dolphin, the little boat must have been swamped.",in the storm of last night answered the dol the little boath must have been swamped,0.125,0.070422535,0.125,0.234375,0.765625
task_1_level_7_clean_254.wav,She only seemed to feel some terror in the air.,she only seemed to feel some terror in the air,0,0,0,0,1
task_1_level_7_clean_255.wav,"Except at one end where the roof had collapsed, this gallery was well preserved.",except at one end ther the roof wol collapsed his gallery as well preserved,0.285714286,0.107692308,0.285714286,0.489795918,0.510204082
task_1_level_7_clean_256.wav,"Perhaps it would, she said, with a hint of surprise in her tone.",perhaps it would she said with a hint of surprise in her tone,0,0,0,0,1
task_1_level_7_clean_257.wav,"Yes, to be sure, I suppose there are.",yes to be sure i suppose there are,0,0,0,0,1
task_1_level_7_clean_258.wav,you would not earn a very good livelihood as a working silversmith at this rate.,you would not earn a very good livery tat as a working solver smith his rate,0.333333333,0.153846154,0.3125,0.495833333,0.504166667
task_1_level_7_clean_259.wav,"They boast and chatter and pretend that they are a great people about to do great affairs in the jungle, but the falling of a nut turns their minds to laughter and all is forgotten.",the boast and chatterd petend that they are great people about to do great affairs in the jungle but the falling of a nuth turns their minds to laughter and all is forgotten,0.171428571,0.04137931,0.171428571,0.271861472,0.728138528
task_1_level_7_clean_260.wav,"But no relations, I believe, and never would marry.",but no relations i believe and never would marry,0,0,0,0,1
task_1_level_7_clean_261.wav,"Tell me, Cricket, who are you?",tell me cricket wo are you,0.166666667,0.045454545,0.166666667,0.305555556,0.694444444
task_1_level_7_clean_262.wav,I have never obeyed anyone and I have always done as I pleased.,i have never obeyed any one and i am always done as i bleased,0.307692308,0.08,0.285714286,0.450549451,0.549450549
task_1_level_7_clean_263.wav,You think of him much more than I do.,you think of him much more than i do,0,0,0,0,1
task_1_level_7_clean_264.wav,I should be so awfully afraid lest you should not like one another.,i should be so awfuly afraid lest you should not like women other,0.230769231,0.074074074,0.230769231,0.408284024,0.591715976
task_1_level_7_clean_265.wav,My mother took me to hear a famous preacher.,my mother took me to hear a famous preacher,0,0,0,0,1
