Filename,Original Text,Transcribed Text,WER,CER,MER,WIL,WIP
task_2_level_3_clean_141.wav,We all saw the lever turn.,we also on lierter,0.833333333,0.5,0.833333333,0.958333333,0.041666667
task_2_level_3_clean_142.wav,"Jimmy, the hero of the hour, the centre of attraction, proved to be the proud possessor of this new kite.",jun e hero a as senter of trastion  to be e prowd cessor his conkint,0.8,0.524390244,0.8,0.946666667,0.053333333
task_2_level_3_clean_143.wav,And yet the most unlikely thing in the world would be that she should have been in this room., yet t most on ine tin  orl  teethan she should be isre,0.789473684,0.527027027,0.789473684,0.929824561,0.070175439
task_2_level_3_clean_144.wav,"What it is, at last to hold you, and touch you, and feel you here!...",what it is it lasto culto i touchen and fei year,0.733333333,0.416666667,0.733333333,0.903030303,0.096969697
task_2_level_3_clean_145.wav,"Another thing was that, viewed as an officer in mufti, he did not look sufficiently professional.",another thing was that oun as it officer in moved  did not ol sufficiently preqession,0.375,0.265822785,0.375,0.583333333,0.416666667
task_2_level_3_clean_146.wav,I thank you but I assure you you are quite mistaken.,i think  but i av sure e pointely,0.727272727,0.585365854,0.727272727,0.897727273,0.102272727
task_2_level_3_clean_147.wav,That is the drift of the current in spite of the eddies.,nat was the drictof the cart in spite of einis,0.583333333,0.340909091,0.583333333,0.791666667,0.208333333
task_2_level_3_clean_148.wav,She was sure that she ought not to be with these men but they had cast a spell over her.,she was sore tis stron heart o me isman but they didn't past a spell of e,0.75,0.470588235,0.714285714,0.9,0.1
task_2_level_3_clean_149.wav,"Having nothing to give him, what do you think my friend did out of the kindness of his heart?",having goten to gitle whatd you think my friend did annissins,0.631578947,0.424657534,0.631578947,0.765550239,0.234449761
task_2_level_3_clean_150.wav,"I assure you, miss, I do nothing else!",i ashore o isi to evhe halse,0.875,0.5,0.875,0.982142857,0.017857143
task_2_level_3_clean_151.wav,"Awful hard luck, said the young man.",often parteo said the hilan,0.714285714,0.607142857,0.714285714,0.885714286,0.114285714
task_2_level_3_clean_152.wav,"But, said I, If it travelled into the past it would have been visible when we came first into this room and last Thursday when we were here and the Thursday before that and so forth!",bu sa e co travelis the past o visible e came first into his sroom as a thirsday e heared an thersta before datsoe,0.805555556,0.465277778,0.805555556,0.943287037,0.056712963
task_2_level_3_clean_153.wav,I who was innocently watching them was amazed to discover how much a fleeting thing like that could hold of seduction without the help of any other feature and with that unchanging glance.,i a is isily watching him as amased to discover how much of eing dan that et wold os sedustion thout the hol of enye ichen en she idto pepes,0.696969697,0.470967742,0.696969697,0.898989899,0.101010101
task_2_level_3_clean_154.wav,"I ask you, Deryck, could I have borne it?",i asked e to her cad bo ant,0.888888889,0.6,0.888888889,0.986111111,0.013888889
task_2_level_3_clean_155.wav,With his burning eyes he was the image of an Inquisitor with an unconquerable soul in that frail body.,with his pert lase a he imagete misiter uncompet he sol and r,0.894736842,0.590361446,0.85,0.963562753,0.036437247
task_2_level_3_clean_156.wav,"Very true, he gravely replied it was very bad.",tertul he greaty we wot was  bod,0.777777778,0.555555556,0.777777778,0.936507937,0.063492063
task_2_level_3_clean_157.wav,We have no rights over his soul.,the ave letl rights o as son,0.857142857,0.56,0.857142857,0.979591837,0.020408163
task_2_level_3_clean_158.wav,"My head was very full of confused images, but I was really too tired to think.",ha is a very wol of e estd in ites ti was pen to tact i,0.875,0.573770492,0.823529412,0.96484375,0.03515625
task_2_level_3_clean_159.wav,"Behold him there, the monarch of the seas!",behold him air ar of e sees,0.625,0.454545455,0.625,0.839285714,0.160714286
task_2_level_3_clean_160.wav,"Why, a man, she said scornfully.",why a she sais scor o,0.666666667,0.416666667,0.666666667,0.888888889,0.111111111
task_2_level_3_clean_161.wav,The conversation of that afternoon would be the supreme test of their friendship.,the conversation an maag to mo  be supremetesif inretion,0.769230769,0.470588235,0.769230769,0.923076923,0.076923077
task_2_level_3_clean_162.wav,It was natural for him to feel that he had cause to sigh.,it was notral for it it e and e caust to sow,0.692307692,0.431818182,0.692307692,0.897435897,0.102564103
task_2_level_3_clean_163.wav,Do you suppose that I shall get it?,do you suppose that i should car itt,0.375,0.259259259,0.375,0.609375,0.390625
task_2_level_3_clean_164.wav,And her face looked like a face in a painting., asin te lat base in  pati,0.9,0.694444444,0.9,0.983333333,0.016666667
task_2_level_3_clean_165.wav,"He lit a cigarette, and went on talking to the two young men.",helit osigarat ite e tolk te two young,0.846153846,0.446808511,0.846153846,0.961538462,0.038461538
task_2_level_3_clean_166.wav,"The cat, which had entered the room as he spoke, hesitated, looked up at him and snarled.",the can wich in eneen o is e spoke as its iti wooke don the star,0.882352941,0.507246377,0.882352941,0.985294118,0.014705882
task_2_level_3_clean_167.wav,I shall not be there when you are hearing this.,i shall not le there  en is,0.6,0.486486486,0.6,0.771428571,0.228571429
task_2_level_3_clean_168.wav,Was this the reception his action would get from the world?,was this loception as action ge,0.727272727,0.520833333,0.727272727,0.863636364,0.136363636
task_2_level_3_clean_169.wav,The Fairy is asleep and does not want to be disturbed.,the fairi is asle is nont on distur,0.818181818,0.418604651,0.818181818,0.954545455,0.045454545
task_2_level_3_clean_170.wav,I was in an agony of discomfort.,asan avey  disapomet,1,0.56,1,1,0
task_2_level_3_clean_171.wav,"I told you I promised my good Fairy to behave myself, and I am going to keep my word.",i told you i caused my woodparit an have myself i a wogto ke my wor,0.578947368,0.338461538,0.578947368,0.789473684,0.210526316
task_2_level_3_clean_172.wav,"She shall know all I know, which could add to your comfort.",she shot  hem all i know to could pact,0.583333333,0.565217391,0.583333333,0.768518519,0.231481481
task_2_level_3_clean_173.wav,I know so many married couples intimately.,i know so many marri nons inti me,0.571428571,0.314285714,0.5,0.714285714,0.285714286
task_2_level_3_clean_174.wav,"He was not exactly what she had expected less of the man of the world in some of his notions, less of the spoiled child of fortune, therefore better than she had expected.",is ni example that she had expected less mann the borlsof isputions less of e spoiled child wohe tero gani  she hispectd,0.696969697,0.404411765,0.696969697,0.862258953,0.137741047
task_2_level_3_clean_175.wav,I do not know how long I lay.,i do not hnow no lo way,0.625,0.333333333,0.625,0.839285714,0.160714286
task_2_level_3_clean_176.wav,Letters are no matter of indifference they are generally a very positive curse.,letters col o matter a difference er genrally very posibleo pers,0.769230769,0.333333333,0.769230769,0.937062937,0.062937063
task_2_level_3_clean_177.wav,"my friend cried, planted so firm that, taking it in, I went straight on without her.",my rade cri  as it so fir ot e taking in and straight on e he,0.75,0.476923077,0.666666667,0.859375,0.140625
task_2_level_3_clean_178.wav,I shall certainly stay and find out.,i shall serainly slay  ,0.714285714,0.448275862,0.714285714,0.857142857,0.142857143
task_2_level_3_clean_179.wav,"To bring on the crisis, she said  There are days when one sees clearly, and this is one of them.",to rig on the gresses she said there ere days conses clearly in mhissis one ofthem,0.55,0.232876712,0.55,0.746875,0.253125
task_2_level_3_clean_180.wav,"She alone knew what had caused it, and unconsciously she put one hand over her bosom as she listened.",she amon e wor a caused him from hociously she fol one hand on er was a she histe,0.684210526,0.444444444,0.684210526,0.900277008,0.099722992
task_2_level_3_clean_181.wav,The shells were falling around us about two to the minute.,the shals or falling roundes upout to aminit,0.727272727,0.361702128,0.727272727,0.897727273,0.102272727
task_2_level_3_clean_182.wav,"You were thinking of a woman, though.",he wase thinking of woman o,0.571428571,0.379310345,0.571428571,0.785714286,0.214285714
task_2_level_3_clean_183.wav,It was as restful as sleeping.,it was as restiples sleek,0.5,0.291666667,0.5,0.7,0.3
task_2_level_3_clean_184.wav,"But they always do, you know.",but they onis do,0.5,0.545454545,0.5,0.625,0.375
task_2_level_3_clean_185.wav,Is that what you did at school?,is that wan you did it scool,0.428571429,0.166666667,0.428571429,0.673469388,0.326530612
task_2_level_3_clean_186.wav,I asked with a certain animation.,i asked o cerly avation,0.666666667,0.444444444,0.666666667,0.866666667,0.133333333
task_2_level_3_clean_187.wav,"If he would act in this sort of manner, on principle, consistently, regularly, their little minds would bend to his.",if you would ask at this sort of ti on ansicer consistently returar litle mon  pans encs,0.65,0.47826087,0.65,0.855882353,0.144117647
task_2_level_3_clean_188.wav,"Not at all, cried he I am much obliged to you for it.",not at all i  a much o plice,0.615384615,0.538461538,0.615384615,0.759615385,0.240384615
task_2_level_3_clean_189.wav,I was lifted aloft on a great wave of infatuation and pity.,i was ite he lot of rer o fasheation ,0.75,0.574468085,0.75,0.916666667,0.083333333
task_2_level_3_clean_190.wav,"I shall hear about you all, said he that is my chief consolation.",i shall hear bout fo  said hiisa she consantlation,0.692307692,0.37254902,0.692307692,0.863247863,0.136752137
task_2_level_3_clean_191.wav,Do not let her enter my room again.,t mala her ette ler an,0.875,0.62962963,0.875,0.979166667,0.020833333
task_2_level_3_clean_192.wav,"He passed his hand over his lips, knowing they trembled a little.",he passed his handor his lips nevera tie,0.583333333,0.423076923,0.583333333,0.739583333,0.260416667
task_2_level_3_clean_193.wav,"Shame to confess it, the other morning I got a friend to look after the cafe for a couple of hours, wrapped up my head, and walked out there to the other end of the town....",shed conmessen her the otemormin io ro ate capin o couple bous rate e head walked out at to the brin  town,0.777777778,0.519083969,0.777777778,0.919191919,0.080808081
task_2_level_3_clean_194.wav,"She could not respect his eye, but his love and his complaisance were unexceptionable.",she could not despect his arm bot his lo n his complecante for unacceptionl,0.571428571,0.295774648,0.571428571,0.816326531,0.183673469
task_2_level_3_clean_195.wav,"The hillock, as I have said, was a kind of island in the forest.",the hilon as i have said as a pigan io porstd,0.571428571,0.416666667,0.571428571,0.766233766,0.233766234
task_2_level_3_clean_196.wav,We had gone far beyond all that.,the gon sarten,1,0.68,1,1,0
task_2_level_3_clean_197.wav,It should not be taken from her.,it should not otake in her,0.428571429,0.28,0.428571429,0.619047619,0.380952381
task_2_level_3_clean_198.wav,??I must look at that machine.,i masn't look at that achone,0.5,0.227272727,0.428571429,0.619047619,0.380952381
task_2_level_3_clean_199.wav,"But when she saw him, pale with fright and with his eyes half out of his head from terror, she began to feel sorry for him and clapped her hands together.",bhu when she saw o panly frighte is eyes had as ane terror she began to dissarder that hastoe,0.741935484,0.545454545,0.741935484,0.891341256,0.108658744
task_2_level_3_clean_200.wav,Are you going to keep on like this much longer?,t e can e one like this wich longer,0.7,0.459459459,0.7,0.9,0.1
task_2_level_3_clean_201.wav,"And now, sit well back, and lower your veil.",an now sipoba lo way,0.888888889,0.606060606,0.888888889,0.977777778,0.022222222
task_2_level_3_clean_202.wav,"I cannot think what people are doing, she would say, but it is extremely fortunate for the children.",i cannot think wor people  do in she weul sayn but it is extremely fortunate what shall re,0.444444444,0.2375,0.444444444,0.691358025,0.308641975
task_2_level_3_clean_203.wav,That was the only reason I went to see Hawberk.,that l be blly reason y went to see hoerk,0.5,0.297297297,0.5,0.75,0.25
task_2_level_3_clean_204.wav,"Come down, you miserable, starved peasant, come down and see.",come down and viserable  scol ise come down a see,0.5,0.375,0.5,0.75,0.25
task_2_level_3_clean_205.wav,But she did not want to stop him.,but she did not andistare,0.5,0.36,0.5,0.6,0.4
task_2_level_3_clean_206.wav,I reached the house door and opened it I was already on the steps.,i reached the hosto bro in as  riminin stips,0.785714286,0.5,0.785714286,0.928571429,0.071428571
task_2_level_3_clean_207.wav,What did you want from me?,but dit you want o me,0.5,0.35,0.5,0.75,0.25
task_2_level_3_clean_208.wav,"Ah, how much had passed away since she stood at that western window, not an hour before.",a o mo to  pass the ace tiious to a their waster o no,1,0.695652174,1,1,0
task_2_level_3_clean_209.wav,"I met the eye of the Psychologist, and read my own interpretation in his face.",i mene ois o otest and rad wier o potation in his face,0.666666667,0.435483871,0.666666667,0.871794872,0.128205128
task_2_level_3_clean_210.wav,Almost without thinking I said I should be pleased.,almos without tetene se,0.888888889,0.595238095,0.888888889,0.972222222,0.027777778
task_2_level_3_clean_211.wav,Have you been trying the old spinet?,had yo e chapa on smit an,1,0.724137931,1,1,0
task_2_level_3_clean_212.wav,Greece is not for our little lot and he got in.,greece was not horon lonto and he goe,0.636363636,0.388888889,0.636363636,0.818181818,0.181818182
task_2_level_3_clean_213.wav,"I must admit that a Marionette fish is, for me, an entirely new kind of fish.",i must age that amari an ise disforme an entirely woconition,0.6875,0.389830508,0.6875,0.857954545,0.142045455
task_2_level_3_clean_214.wav,He called me to him at the chancel step.,e calledlens wet he ot the chanes sthen,0.888888889,0.451612903,0.888888889,0.986111111,0.013888889
task_2_level_3_clean_215.wav,And how did she take it?,and how so takin,0.666666667,0.388888889,0.666666667,0.833333333,0.166666667
task_2_level_3_clean_216.wav,There is no need to spell out simple words for me.,there is no need to scass  or me,0.454545455,0.435897436,0.454545455,0.590909091,0.409090909
task_2_level_3_clean_217.wav,"She bit her lip, narrowed her idle gaze on the meadows that flew by the car window.",she bie her hem or narrow r i aas e mit as that on bot a tarte o,0.882352941,0.553846154,0.833333333,0.970588235,0.029411765
task_2_level_3_clean_218.wav,It was at a Thanksgiving service when some of our troops returned from South Africa.,it was at a nexcans ose some montres we to hene asel,0.666666667,0.652173913,0.666666667,0.861111111,0.138888889
task_2_level_3_clean_219.wav,"He rose when she spoke, and began to dust his knees.",he rose what she supoke and began to dust his ees,0.272727273,0.125,0.272727273,0.47107438,0.52892562
task_2_level_3_clean_220.wav,And that letter was on a matter of importance.,mo lotter ws on the oteords,0.888888889,0.621621622,0.888888889,0.981481481,0.018518519
task_2_level_3_clean_221.wav,I have no doubt it was meant for a purely operatic Faust.,i have a ol dou ot his min o she look  of e faste,1,0.577777778,0.857142857,0.976190476,0.023809524
task_2_level_3_clean_222.wav,"She seemed to propose shewing no agitation, or disappointment, or peculiar concern in the discovery.",she seemed to bropose she ad know attitation disappointment of theceor concern hiscovered,0.666666667,0.289156627,0.666666667,0.871794872,0.128205128
task_2_level_3_clean_223.wav,But there is no arm about me now.,bat there is no arer on no,0.625,0.36,0.625,0.839285714,0.160714286
task_2_level_3_clean_224.wav,You may imagine how all my calm vanished.,me baton or all my cal manshed,0.75,0.424242424,0.75,0.928571429,0.071428571
task_2_level_3_clean_225.wav,Was he shivering from fear or from cold?,was he shiver on fear or her mold,0.5,0.3125,0.5,0.75,0.25
task_2_level_3_clean_226.wav,"I held her close, pleading, caressing I seized her, white with anger, but she resisted.",i helt her wlas   caressing es sis wite biner whic she wessisted,0.733333333,0.455882353,0.733333333,0.911111111,0.088888889
task_2_level_3_clean_227.wav,"Well, that night the expectation took the colour of my fears.",well that night the expectation of the covor of wo dears,0.363636364,0.145833333,0.363636364,0.595041322,0.404958678
task_2_level_3_clean_228.wav,Presently she rose with a jerk of her tail and started on a noiseless tour of the studio.,resolaa she rose it e turbe ce tail hi started  noiseness to orthe studien,0.777777778,0.394366197,0.777777778,0.936507937,0.063492063
task_2_level_3_clean_229.wav,The fellow was having houses built all over the place.,the fellow was having be houses gos all os,0.5,0.409090909,0.454545455,0.6,0.4
task_2_level_3_clean_230.wav,No. I cannot expect you to believe it.,no i cannot expect it fo ee,0.5,0.379310345,0.5,0.714285714,0.285714286
task_2_level_3_clean_231.wav,I am going to sea this evening.,i a a to see ise,0.714285714,0.625,0.714285714,0.904761905,0.095238095
task_2_level_3_clean_232.wav,Do you think she will find me much changed?,to you think she will find om mas change,0.444444444,0.205882353,0.444444444,0.691358025,0.308641975
task_2_level_3_clean_233.wav,"As the evening drew on, my interest waned.",as then evning to on i interestenlaet,0.75,0.393939394,0.75,0.928571429,0.071428571
task_2_level_3_clean_234.wav,"I knew nothing in heaven or earth but that this love was mine, and was for me.",i div nothing in heaven or erte tot o this lons wine was gor me,0.529411765,0.35,0.529411765,0.749019608,0.250980392
task_2_level_3_clean_235.wav,He has troubled the jungle for ten seasons.,he is troubled the general ten seasons,0.375,0.257142857,0.375,0.553571429,0.446428571
task_2_level_3_clean_236.wav,The landscape was misty and vague.,the lanscape is cisted in bay,0.833333333,0.428571429,0.833333333,0.972222222,0.027777778
task_2_level_3_clean_237.wav,We were just in time my mother just ready for us.,we woure just idn' time her mother un as rean es,0.636363636,0.421052632,0.636363636,0.867768595,0.132231405
task_2_level_3_clean_238.wav,The first thing I remember I abused your sister horribly this morning.,the first thing i womenerd i hav used your sisce  ores or,0.583333333,0.396551724,0.538461538,0.75,0.25
task_2_level_3_clean_239.wav,"She might not escape, there was nothing for it but courage, now.",she might onescape i as nothing wor too curage how,0.75,0.3,0.75,0.925,0.075
task_2_level_3_clean_240.wav,"I suppose you know there are risks, I mean apart from the risk of life.",i suppose you il ter are risks  par o iso life,0.6,0.4,0.6,0.781818182,0.218181818
task_2_level_3_clean_241.wav,"It is certainly the simplest, and perhaps the best.",it is certin in the cenblest pass the best,0.555555556,0.341463415,0.5,0.691358025,0.308641975
task_2_level_3_clean_242.wav,"And the mysterious lady in grey, I suggested sarcastically.",a ma steriously e crie isuggest en soe castice,1,0.408163265,1,1,0
task_2_level_3_clean_243.wav,He placed a little pan over a foot warmer full of hot coals.,he placet hi e han efo or orfor cals,0.923076923,0.510638298,0.923076923,0.991452991,0.008547009
task_2_level_3_clean_244.wav,"At the sight of that pale little corpse, the boys were so frightened that they turned tail and ran.",at the sime tate hilld e course he boys were so frain  tat they to ontail  ond,0.684210526,0.405063291,0.684210526,0.888544892,0.111455108
task_2_level_3_clean_245.wav,"She called me a sinful girl, a shameless creature.",she cagt ly as cynical girl as she was preatere,0.888888889,0.475,0.8,0.955555556,0.044444444
task_2_level_3_clean_246.wav,"Pardon me, said a frigid voice.",pardon said into the ose,0.666666667,0.5,0.666666667,0.866666667,0.133333333
task_2_level_3_clean_247.wav,"Thus he and the duchess kept up a tinkling duet, each hearing the other, and not their own sounds.",thus e an aduches kapt up an tining to bet ea hearile her id latther on e souns,0.894736842,0.376623377,0.894736842,0.988304094,0.011695906
task_2_level_3_clean_248.wav,It will be the best thing in the world for her!,it will be the fest tan th world,0.545454545,0.361111111,0.545454545,0.715909091,0.284090909
task_2_level_3_clean_249.wav,She used your brushes to do it up again in front of your glass.,she his you brushas to git ot again the glass,0.714285714,0.448979592,0.714285714,0.885714286,0.114285714
task_2_level_3_clean_250.wav,This very house where we are sitting belonged to him.,isgar has as iti te long,1,0.651162791,1,1,0
task_2_level_3_clean_251.wav,I hope he boxed your ears.,i wold co bast her es,0.833333333,0.7,0.833333333,0.972222222,0.027777778
task_2_level_3_clean_252.wav,My admirer will hardly trouble me again.,at maner for etoe,1,0.757575758,1,1,0
task_2_level_3_clean_253.wav,I was surprised to find it had been carefully oiled and cleaned.,i was surprised a mi  han ben pare y poind teaed,0.75,0.423076923,0.75,0.931818182,0.068181818
task_2_level_3_clean_254.wav,I never knew what peace meant before...,and never new what espend,0.714285714,0.566666667,0.714285714,0.885714286,0.114285714
task_2_level_3_clean_255.wav,I never heard any county but Surry called so.,i i hereny conen in ser calso,0.888888889,0.555555556,0.888888889,0.984126984,0.015873016
task_2_level_3_clean_256.wav,I am talking about the sweet old lady who came in a carriage.,i talk bos speeple lady  came carise,0.769230769,0.5,0.769230769,0.901098901,0.098901099
task_2_level_3_clean_257.wav,"I mean that you and I shall quietly get married in a few weeks, when I am free, he answered.",i mean then you and i shall quire l get har e po bease when i afree iser,0.6,0.371428571,0.571428571,0.775,0.225
task_2_level_3_clean_258.wav,"But Mummie asks them whether it is raining, or whether they think it has been raining, or is going to rain and when they have told her, she hurries away and asks somebody else.",but wone asks e other atens o baby te they think it has been making or his going to ree and mey ad told mashe eas way and askd somebod ese,0.617647059,0.395683453,0.617647059,0.839658444,0.160341556
task_2_level_3_clean_259.wav,In the presence of what I saw I reeled straight back upon my resistance.,in the bans of li sar bein street bac sistence,0.785714286,0.534482759,0.785714286,0.935714286,0.064285714
task_2_level_3_clean_260.wav,The chief of the great arms smuggling organization!,but she the brig alfs sape wassation,0.875,0.627906977,0.875,0.982142857,0.017857143
task_2_level_3_clean_261.wav,Notwithstanding my perfect liberty of mind I was not aware of what we were eating.,nots an i tin mint i s bota ware,0.933333333,0.686567164,0.933333333,0.992592593,0.007407407
task_2_level_3_clean_262.wav,"But first she went to the window, and leaned out into the sweet darkness.",the fist she wanted i  len at ant thi sweet dons,0.857142857,0.517241379,0.857142857,0.974025974,0.025974026
task_2_level_3_clean_263.wav,"Her expression, at this, became extraordinary.",for expression at his became xtraode,0.5,0.263157895,0.5,0.75,0.25
task_2_level_3_clean_264.wav,The Time Traveller put his hand to his head.,the time as hape o his ehad to his hand,0.555555556,0.4,0.5,0.722222222,0.277777778
task_2_level_3_clean_265.wav,Why should this little man be lying on his own account?,why should his ti oman  i o,0.818181818,0.590909091,0.818181818,0.948051948,0.051948052
task_2_level_3_clean_266.wav,The book she had been reading slipped with a thump on the floor.,the book she had been mearing slip ith he fan,0.615384615,0.37254902,0.615384615,0.807692308,0.192307692
task_2_level_3_clean_267.wav,There is no intelligence where there is no change and no need of change.,there is no intelligence  there is potinetion on meedin change,0.5,0.275862069,0.5,0.65,0.35
task_2_level_3_clean_268.wav,"Go, and peace go with thee.",gon pease goi,1,0.5,1,1,0
task_2_level_3_clean_269.wav,He was the shadow and the light and the form and the voice.,he was the shouow on lighe  or borce,0.769230769,0.5,0.769230769,0.913461538,0.086538462
task_2_level_3_clean_270.wav,It was a faithful little vessel.,it was as fagteful little vessel,0.333333333,0.115384615,0.333333333,0.555555556,0.444444444
task_2_level_3_clean_271.wav,If she is ill I should be sorry to do her injustice but there are some traits in her character which make it difficult for me to speak of her with the forbearance I could wish.,if she is i astion o sor to i chuses but there are so transin em caracter tween it difficult for ee disapeate e ot the forbearins so which,0.666666667,0.435714286,0.666666667,0.862068966,0.137931034
task_2_level_3_clean_272.wav,He will connect himself well if he can.,he will conect himself awell an,0.625,0.225806452,0.625,0.8125,0.1875
task_2_level_3_clean_273.wav,"Do you want one hundred, a thousand, two thousand gold pieces for your miserable five?",do you want o one hundred thousand o two thousand gold pieces  miserable lide,0.4,0.173913043,0.375,0.523809524,0.476190476
task_2_level_3_clean_274.wav,"Make it an allowance, if you like.",they cen o lasse,1,0.807692308,1,1,0
task_2_level_3_clean_275.wav,I am laughing at your lies.,ai es,1,0.80952381,1,1,0
task_2_level_3_clean_276.wav,"I crossed the room softly opened my window, and leaned out.",i mas  re eself ove by e dar en at,0.909090909,0.70212766,0.909090909,0.990909091,0.009090909
