Filename,Original Text,Transcribed Text,WER,CER,MER,WIL,WIP
task_2_level_3_clean_277.wav,"you would rather talk of her person than her mind, would you?",you would runn at tole ho vesson mind when she nte,0.833333333,0.604166667,0.833333333,0.96969697,0.03030303
task_2_level_3_clean_278.wav,Now you have nothing to try for.,now e e not  to chil,0.714285714,0.64,0.714285714,0.904761905,0.095238095
task_2_level_3_clean_279.wav,"He joined them immediately, and, with scarcely an invitation, seated himself between them.",an joyn et e meey with scarcely amimitation o seeted her sont,0.846153846,0.472972973,0.846153846,0.974358974,0.025641026
task_2_level_3_clean_280.wav,"Somewhat mollified, he sat down again.",so wa lol fird a said to gain,1.333333333,0.483870968,1,1,0
task_2_level_3_clean_281.wav,There was a hint of the teacher about him.,there was a in on pe teacher bou,0.555555556,0.303030303,0.555555556,0.777777778,0.222222222
task_2_level_3_clean_282.wav,"And, in any case, we are infinitely safer than if we were walking.",and ene case whe are intiment to satee walk,0.769230769,0.529411765,0.769230769,0.923076923,0.076923077
task_2_level_3_clean_283.wav,It has become a habit with you of late.,it is become a habit o liht,0.555555556,0.433333333,0.555555556,0.746031746,0.253968254
task_2_level_3_clean_284.wav,I am really glad of an opportunity of helping on your excellent work in this neighbourhood.,i really glad ow to the lee i helping i her excelent ogins newo,0.8125,0.5,0.764705882,0.928571429,0.071428571
task_2_level_3_clean_285.wav,Get hence quickly or the priest will turn thee into a wolf again.,get had o e le on the priesta turnle ento a olfa,0.846153846,0.423076923,0.846153846,0.974358974,0.025641026
task_2_level_3_clean_286.wav,He is mine and I am his.,hi s bloce is,1,0.705882353,1,1,0
task_2_level_3_clean_287.wav,"This, his first great adventure, as he calls it, begins in Marseilles.",this is first bring aventunis possible egin his e marcel,0.833333333,0.472727273,0.833333333,0.966666667,0.033333333
task_2_level_3_clean_288.wav,I want you to save yourself from greater pain.,i want yo to see herself greater pan,0.555555556,0.297297297,0.555555556,0.777777778,0.222222222
task_2_level_3_clean_289.wav,I wanted to run from it.,i want to mono,0.666666667,0.5,0.666666667,0.833333333,0.166666667
task_2_level_3_clean_290.wav,"No, I have said nothing indiscreet.",no issoman indescrepte,0.833333333,0.535714286,0.833333333,0.944444444,0.055555556
task_2_level_3_clean_291.wav,"I have never seen anything so beautiful, and so beautifully managed.",o never seen an e so beautiful and so beaty hanhed,0.545454545,0.357142857,0.5,0.702479339,0.297520661
task_2_level_3_clean_292.wav,I believe I did not play with the children quite so much as usual.,i believe i don not play with e children o wit soiusi,0.5,0.307692308,0.5,0.708333333,0.291666667
task_2_level_3_clean_293.wav,"he cried, shouting in at the open door, through which much squalor was visible.",the cride shatted him e to through which a hanthous swallows bisible,0.857142857,0.507936508,0.857142857,0.976190476,0.023809524
task_2_level_3_clean_294.wav,But if he put the inference by without a smile it was also without irritation.,bet if o bean forcs far out a su it was minsirer actortation,0.733333333,0.571428571,0.733333333,0.917948718,0.082051282
task_2_level_3_clean_295.wav,His eye fell with a mute inquiry upon the withered white flowers upon the little table.,his eyeste o e e war one witherd white clowers o om the ran ta,0.875,0.492957746,0.875,0.983333333,0.016666667
task_2_level_3_clean_296.wav,"The noble figure of a woman, nobly painted, was the first impression which leapt from eye to brain.",no iur  no pan was the first inpression which that a in to bran,0.722222222,0.455696203,0.722222222,0.900793651,0.099206349
,,,,,,,
,,,,0.453420012,,,
