Filename,Original Text,Transcribed Text,WER,CER,MER,WIL,WIP
task_2_level_3_clean_001.wav,"No, retorted Maggie, I know what I said and I said what I meant.",no to a no wat i said i said what i meand,0.5,0.395833333,0.5,0.708333333,0.291666667
task_2_level_3_clean_002.wav,"The fault of Euphemia is that she will not, simply will not, chop the suet sufficiently small.", altity meed is as she o not simply wol not chop the siicofficien smal,0.588235294,0.426666667,0.588235294,0.794117647,0.205882353
task_2_level_3_clean_003.wav,If he had only known then the dreadful things that were to happen to him on account of his disobedience!,if he had open ol man e trefl es ate to happen to him on a count of his disaplinins,0.55,0.404761905,0.523809524,0.75,0.25
task_2_level_3_clean_004.wav,That place is too sweetly squalid for words.,that was is to sweeply swallowing wors,0.75,0.416666667,0.75,0.928571429,0.071428571
task_2_level_3_clean_005.wav,"Part only of this answer, however, was admitted.",wat wav the isans er how e posi me,1.125,0.552631579,1,1,0
task_2_level_3_clean_006.wav,While you were away in the city the Fox and the Cat returned here in a great hurry.,wile you rewan sidi past the cabi tur er a great birg,0.777777778,0.523076923,0.777777778,0.925925926,0.074074074
task_2_level_3_clean_007.wav,That your cousin has always hoped.,they to cousin has always oet,0.5,0.285714286,0.5,0.75,0.25
task_2_level_3_clean_008.wav,You shall hear tomorrow what she learned.,he shall bance qare,0.857142857,0.705882353,0.857142857,0.964285714,0.035714286
task_2_level_3_clean_009.wav,To kill a naked cub is shame.,to kill a make in oes shame,0.428571429,0.272727273,0.428571429,0.673469388,0.326530612
task_2_level_3_clean_010.wav,had she wronged him with her fears for the future?,as she last hor fears for the fuger,0.6,0.475,0.6,0.8,0.2
task_2_level_3_clean_011.wav,"You see how he could see, I meanwhile went on.",he see how not e see and e or hpentoi,0.7,0.542857143,0.7,0.91,0.09
task_2_level_3_clean_012.wav,His one impulse was to put his arms about her.,his one en halse was to fit his arms about,0.4,0.25,0.363636364,0.51,0.49
task_2_level_3_clean_013.wav,"The wood is full of footsteps, said the doctor, just as the heart is full of echoes.",the wood is foe look steps tat the daughter just as her hearts  ome panes,0.647058824,0.384615385,0.647058824,0.858823529,0.141176471
task_2_level_3_clean_014.wav,"She was not yet quite able to see him and his charming happy wife together, without feeling uncomfortable.",she was not hittin wy aner to see him in its charming hal an wile together without feeling y hon,0.555555556,0.344827586,0.5,0.722222222,0.277777778
task_2_level_3_clean_015.wav,His progress in his art was not arrested.,his progress in his heart was not rested,0.25,0.121212121,0.25,0.4375,0.5625
task_2_level_3_clean_016.wav,"Whichever way they looked, kind ladies smiled and shouted at them.",the caten wen tey ois ciy e swile  shouted,0.909090909,0.611111111,0.909090909,0.98989899,0.01010101
task_2_level_3_clean_017.wav,"Answer me quickly, pretty Snail, where have you left my Fairy?",intere i had en prise now where a e other o fary,1,0.591836735,0.916666667,0.992424242,0.007575758
task_2_level_3_clean_018.wav,But the moment had its thrill for her.,thut the moment hadis rile,0.75,0.366666667,0.75,0.9,0.1
task_2_level_3_clean_019.wav,I watched her with the greatest anxiety composing her face into a cheerful expression.,i watched her e greatest thingxie botsig her face in to the cheren is russion,0.714285714,0.388888889,0.625,0.828571429,0.171428571
task_2_level_3_clean_020.wav,"Even if my dress is thinner it will not show so much, being brown.",even if my tresses of thenner rashas sol much being ron,0.642857143,0.37254902,0.642857143,0.837662338,0.162337662
task_2_level_3_clean_021.wav,"He leaned back in his chair, his face turned upwards.",e le to at is chaires face ton ons,0.9,0.547619048,0.9,0.988888889,0.011111111
task_2_level_3_clean_022.wav,"Then he smiled, saying, For whom do you wait?",thet i smile see for lo de waiting,0.888888889,0.558823529,0.888888889,0.986111111,0.013888889
task_2_level_3_clean_023.wav,"With the plain, reasonable daylight, I could look my circumstances fairly in the face.",with a plan resicle daylah a could look my serfuc ances faras,0.714285714,0.428571429,0.714285714,0.904761905,0.095238095
task_2_level_3_clean_024.wav,I am afraid I cannot convey the peculiar sensations of time travelling.,i wa wed a ot late se saso te,0.916666667,0.728813559,0.916666667,0.990740741,0.009259259
task_2_level_3_clean_025.wav,I am not so sure of that now.,i not so sure that,0.375,0.333333333,0.375,0.375,0.625
task_2_level_3_clean_026.wav,And sometimes I wear ties and things to match them.,in sometimes eter tiesos to mash em,0.8,0.414634146,0.8,0.942857143,0.057142857
task_2_level_3_clean_027.wav,The door below opened and shut.,dor a lo e e shad,1,0.64,1,1,0
task_2_level_3_clean_028.wav,"For the last time, are you coming or not?",to the last tine coe,0.777777778,0.580645161,0.777777778,0.911111111,0.088888889
task_2_level_3_clean_029.wav,"He hinted this to her, and she accepted the hint eagerly.",he hintered his to par and she accepted le ante teur,0.545454545,0.311111111,0.545454545,0.79338843,0.20661157
task_2_level_3_clean_030.wav,But perhaps it only seems so to you in contrast with the lady so perfect in her way.,the perhaps i oly sen so to ye ad contrasten the lady so er way,0.611111111,0.393939394,0.611111111,0.818518519,0.181481481
task_2_level_3_clean_031.wav,"And a feeble voice came quavering from within the house, Courtoisie.",in a few ol voys cave tewater or in the house cortes,0.818181818,0.5,0.75,0.931818182,0.068181818
task_2_level_3_clean_032.wav,And now I can tolerably comprehend his behaviour.,and now i can is aller ro comprehend to behavin,0.625,0.325,0.5,0.6875,0.3125
task_2_level_3_clean_033.wav,There is nothing doing on the moors now.,there is not to i ens,0.75,0.5625,0.75,0.916666667,0.083333333
task_2_level_3_clean_034.wav,And I think you would like the pine woods and the moor.,and i thin to te timeo the tine o os and te fore,0.75,0.418604651,0.692307692,0.897435897,0.102564103
task_2_level_3_clean_035.wav,But perhaps I had better not speak of this.,et perhaps i e e ons speakof this,0.666666667,0.323529412,0.666666667,0.875,0.125
task_2_level_3_clean_036.wav,"What would the jungle think if I, the Black Panther, curled myself up like Ikki the Porcupine, and howled?",what the gene tini iie curld myself up i tecame a wori oa,0.789473684,0.583333333,0.789473684,0.935222672,0.064777328
task_2_level_3_clean_037.wav,I would have to pay her for it.,i wold have to pay ,0.5,0.391304348,0.5,0.6,0.4
task_2_level_3_clean_038.wav,That man and that woman seemed to know something.,that a a a seems to toso,0.777777778,0.6,0.777777778,0.936507937,0.063492063
task_2_level_3_clean_039.wav,It is that love and youth matter intellectually.,it is not one matter is lection,0.75,0.55,0.75,0.928571429,0.071428571
task_2_level_3_clean_040.wav,Then she opened the orange envelope.,ten she an e te orn can,1,0.533333333,0.857142857,0.976190476,0.023809524
task_2_level_3_clean_041.wav,How came you to be caught in this trap?,howkin  conpi es trac,1,0.7,1,1,0
task_2_level_3_clean_042.wav,"I did not know that I had fixed a day, but as he says I did, I am going now.",i did not know that i had fix o da but as a says i her,0.45,0.37037037,0.45,0.621875,0.378125
task_2_level_3_clean_043.wav,"They alighted, and Myra trailed into the hall with a lazy grace which gave no indication of the masterly way she had handled her ponies, but rather suggested stepping from a comfortable seat in a barouche.",the alane  my re traded it to  all  leasy gres whic ga no itaation  e masce wation an e is but rather suggested stepping a comfortable seat,0.777777778,0.437125749,0.777777778,0.934156379,0.065843621
task_2_level_3_clean_044.wav,They looked at each other in silence.,e looked a each other a since,0.571428571,0.266666667,0.571428571,0.816326531,0.183673469
task_2_level_3_clean_045.wav,"He had thrown her photographs into it, and then he had told her the reason.",the end thrown oragrass to in and then he adteten piesi,0.733333333,0.474576271,0.733333333,0.903030303,0.096969697
task_2_level_3_clean_046.wav,"Not only one penny, answered the Coal Man.",no o wold one answered the col,0.75,0.393939394,0.666666667,0.839285714,0.160714286
task_2_level_3_clean_047.wav,She had soon fixed on the size and sort of portrait.,she as sooned extise sies ne sofe qortrit,0.909090909,0.43902439,0.909090909,0.988636364,0.011363636
task_2_level_3_clean_048.wav,"My boy, as for clothes, I have only a bag in which I keep hops.",mi boy as re clothes a le bac a ce hops,0.666666667,0.5,0.666666667,0.848484848,0.151515152
task_2_level_3_clean_049.wav,I felt convinced that he was no proper person to be a messenger to headquarters.,i tolt to vinc that ot was nol pro per son to be message to cales,0.733333333,0.384615385,0.647058824,0.85,0.15
task_2_level_3_clean_050.wav,The fair and the dark are succeeding each other like leaves blown in the wind dancing in and out.,the fairf jon are succeeding wech other on theaves flowing the wind to his inend out,0.631578947,0.346153846,0.631578947,0.838815789,0.161184211
task_2_level_3_clean_051.wav,But I enjoyed the meals more on the happy occasions when it was there.,but i enjoyed e is a foron half as wis it was there,0.571428571,0.428571429,0.571428571,0.802197802,0.197802198
task_2_level_3_clean_052.wav,She appeared distracted by my curt Yes.,she had herd di stractin by eror less,1,0.4375,0.777777778,0.928571429,0.071428571
task_2_level_3_clean_053.wav,It was I who fell into the trap!,it as i  tos o char,0.75,0.625,0.75,0.916666667,0.083333333
task_2_level_3_clean_054.wav,Ask the Fairy to help me!,aske varris hole,1,0.526315789,1,1,0
task_2_level_3_clean_055.wav,"Her bank account receives a monthly check she sends all her household bills to my secretary, Fox.",the ban cown e season on wi shane she sats all e hoseholon iss to my seceo box,0.823529412,0.481012658,0.777777778,0.947712418,0.052287582
task_2_level_3_clean_056.wav,The thump on the door was awful as if he had not been able to stop himself in time., donal one taris of as if cd hav not bigan e to stop sntime,0.736842105,0.53125,0.736842105,0.906015038,0.093984962
task_2_level_3_clean_057.wav,I use it to rub my chest with.,i useing to ruber cheste,0.75,0.363636364,0.75,0.9,0.1
task_2_level_3_clean_058.wav,"You, know perfectly well that nobody could fill your place!",you know whater you are o ite etase,0.8,0.666666667,0.8,0.95,0.05
task_2_level_3_clean_059.wav,"said the fisher folk on the shore, whispering a prayer as they turned to go home.",se on isien one on shore whisperind a bra as they turned to go out,0.5,0.359375,0.5,0.733333333,0.266666667
task_2_level_3_clean_060.wav,And how did he get out?,and how s  get,0.5,0.470588235,0.5,0.625,0.375
task_2_level_3_clean_061.wav,Why will he look at that fresco?,why will yeu look at that presiden,0.285714286,0.28,0.285714286,0.489795918,0.510204082
task_2_level_3_clean_062.wav,"When he gets married, he will have time to laugh.",e gets married he will hat to in in to la,0.7,0.368421053,0.583333333,0.772727273,0.227272727
task_2_level_3_clean_063.wav,Really you are becoming abnormally quick of hearing.,really long to ot er,0.875,0.704545455,0.875,0.975,0.025
task_2_level_3_clean_064.wav,"For I am a rascal, fine on promises which I never keep!",for i kaw ras  fiin fromse which a ee ken,0.75,0.428571429,0.75,0.925,0.075
task_2_level_3_clean_065.wav,"You have lashed me well, Boy, she said, as only words spoken in faithful indignation can lash.",you was lashed you ol moshe said as o e word spoke an fatlin tivation an lash,0.764705882,0.324324324,0.722222222,0.91349481,0.08650519
task_2_level_3_clean_066.wav,"Not waiting another moment, he darted swiftly through the woods, the Assassins still after him.",nomin to enother mond the dante swift os the assassines sti on,0.933333333,0.5,0.933333333,0.994444444,0.005555556
task_2_level_3_clean_067.wav,and I always thought you meant it.,al as togt ,1,0.703703704,1,1,0
task_2_level_3_clean_068.wav,"I do like the simile, she said.",i do like a samige s,0.571428571,0.47826087,0.571428571,0.785714286,0.214285714
task_2_level_3_clean_069.wav,"Is that house to let again, Powell?",the house a e o,0.857142857,0.666666667,0.857142857,0.971428571,0.028571429
task_2_level_3_clean_070.wav,"But then, where could it be?",the thata welt o men,1,0.761904762,1,1,0
task_2_level_3_clean_071.wav,"It was time, she whispered secretly.",it was time she was conceidedly,0.333333333,0.379310345,0.333333333,0.555555556,0.444444444
task_2_level_3_clean_072.wav,"He was moaning and complaining and threatening all the world, including his father and mother.",he was loning in to tlaing threate all world including his fother abon,0.6,0.346153846,0.6,0.815384615,0.184615385
task_2_level_3_clean_073.wav,"Shells fell everywhere, bursting along the embankment, splashing them with frozen slush.",shelsfelli e forsting long in age splashing e  loses lush,0.916666667,0.459459459,0.916666667,0.991666667,0.008333333
task_2_level_3_clean_074.wav,I felt hardly alive but for the cruel pain that possessed my whole being.,i felt harthy lan it wo pain and the sessine,0.785714286,0.610169492,0.785714286,0.935714286,0.064285714
task_2_level_3_clean_075.wav,"As I put on pace, night followed day like the flapping of a black wing.",as i could on ace nah er followed did the flad  blac room,0.733333333,0.490909091,0.6875,0.871794872,0.128205128
task_2_level_3_clean_076.wav,But I believe she was too distracted and worried to think consecutively.,u atelie o is to distracted wor i sece,0.916666667,0.566666667,0.916666667,0.990740741,0.009259259
task_2_level_3_clean_077.wav,You are far too good to me., ar fast i e to me,0.714285714,0.55,0.714285714,0.904761905,0.095238095
task_2_level_3_clean_078.wav,"You see, she has never seen such an enormous town before in her life, nor yet so many strange people.",you see she is never seen such a lit orest hal yes ser then mistrent,0.7,0.518987342,0.7,0.88,0.12
task_2_level_3_clean_079.wav,I seemed to remember that she slept in any bed that happened to be vacant.,i seene to e over than she slalped in e an in bed e hapt e mane,0.866666667,0.508474576,0.722222222,0.901960784,0.098039216
task_2_level_3_clean_080.wav,"You would enjoy the view from the terrace, sheer into the gorge, and away across the purple hills.",wen enjoy e a the terrace she is forge and away cross the foos,0.666666667,0.474358974,0.666666667,0.857142857,0.142857143
task_2_level_3_clean_081.wav,"I feel a strong persuasion, this morning, that I shall soon be abroad.",i hav a stongerspace for asches soon ha blong,0.769230769,0.6,0.769230769,0.923076923,0.076923077
task_2_level_3_clean_082.wav,"By no means, said the doctor, but a distinctly unusual patient.",i know me asse toc ta distinctly igual ation,0.909090909,0.44,0.909090909,0.98989899,0.01010101
task_2_level_3_clean_083.wav,"No one knew, or seemed to care.",no oe o seem to car,0.714285714,0.391304348,0.714285714,0.904761905,0.095238095
task_2_level_3_clean_084.wav,"No, a world of lovers would be impossible.",no girl wa lovers wol e impossibly,0.75,0.303030303,0.75,0.928571429,0.071428571
task_2_level_3_clean_085.wav,"The roads, the fields, the ditches were full of them, and many of them fell.",the ros and feels te diches were full of hem and many of them ar no,0.533333333,0.24137931,0.5,0.733333333,0.266666667
task_2_level_3_clean_086.wav,This was all sent with the instrument.,this was all sat instrament,0.571428571,0.322580645,0.571428571,0.742857143,0.257142857
task_2_level_3_clean_087.wav,"She turned it this way and that, eluding my hand with repressed low, little moans.",she trurned in i his way an bac ee my hand pressed worl ols,0.8,0.446153846,0.75,0.923809524,0.076190476
task_2_level_3_clean_088.wav,"But you are otherwise, you gentlemen.",but you  are i sa ,0.5,0.633333333,0.5,0.7,0.3
task_2_level_3_clean_089.wav,The little fat man did not laugh.,a little bat  o,0.857142857,0.653846154,0.857142857,0.964285714,0.035714286
task_2_level_3_clean_090.wav,The doctor rose and sauntered round the bend of the path.,the docter crised as sort o groun and,0.909090909,0.608695652,0.909090909,0.988636364,0.011363636
task_2_level_3_clean_091.wav,"cried the fisher folk on the shore, and again they mumbled a few prayers, as they returned home.",ri el fisher fol e sho gan  to grars ta turn o,0.944444444,0.605263158,0.944444444,0.99537037,0.00462963
task_2_level_3_clean_092.wav,His hand crashed down upon the bass.,his hand in rase down on e base,0.714285714,0.310344828,0.625,0.839285714,0.160714286
task_2_level_3_clean_093.wav,"I can honestly say this, it being even more true than appears.",i can honso say this it bein him more driven pese,0.5,0.408163265,0.5,0.727272727,0.272727273
task_2_level_3_clean_094.wav,"There were shrubberies and big trees, but I remember the clear assurance I felt that none of them concealed him.",ther were shunges on beatrees but i  noe ther shos e o am e se,0.85,0.593406593,0.85,0.97,0.03
task_2_level_3_clean_095.wav,"It is odd, too, how speedily I came to disregard these little people.",it is on to o seety i nane to disrequire,0.692307692,0.555555556,0.692307692,0.876923077,0.123076923
task_2_level_3_clean_096.wav,"I have never been there, but I can well imagine it.",an ever been  but i coul well ante,0.636363636,0.487179487,0.636363636,0.818181818,0.181818182
task_2_level_3_clean_097.wav,Again the boys shouted with laughter.,again an was shout at,0.833333333,0.580645161,0.833333333,0.966666667,0.033333333
task_2_level_3_clean_098.wav,I lit my last match ??and it incontinently went out.,a tin ask pash and pe conton i at,0.9,0.65,0.9,0.988888889,0.011111111
task_2_level_3_clean_099.wav,You mean to say that that machine has travelled into the future?, men to say that bashon wis traveled to the centry,0.666666667,0.423076923,0.666666667,0.866666667,0.133333333
task_2_level_3_clean_100.wav,"At those piercing shrieks, a Dormouse came into the room, a fat little Dormouse, who lived upstairs.",at those perso  shreeks we doasiatin to the rom bag a os wi dustairs,0.823529412,0.475,0.823529412,0.962184874,0.037815126
task_2_level_3_clean_101.wav,Young as I was I had solved for myself that grotesque and sombre personality.,youngs ar was a e sol wisel pertest in som s pat,0.928571429,0.587301587,0.928571429,0.994047619,0.005952381
task_2_level_3_clean_102.wav,"The fine unexpected chords, full of discords working into harmony, seemed to suit her mood and her memories.",the finance feris a foll of discords woreing into marmon seemed to se the o er thees,0.666666667,0.375,0.666666667,0.882352941,0.117647059
task_2_level_3_clean_103.wav,I said that I was no good.,i sond hat i was no good,0.285714286,0.157894737,0.285714286,0.489795918,0.510204082
task_2_level_3_clean_104.wav,"Motives are all very well, but the fence comes here.",lois are all er o but the fans cose,0.6,0.43902439,0.6,0.822222222,0.177777778
task_2_level_3_clean_105.wav,The silence in the street was absolute.,the silence of the street was absolute,0.142857143,0.0625,0.142857143,0.265306122,0.734693878
task_2_level_3_clean_106.wav,"The same woman, seated as before but the man was not there and in her arms, its tiny dark head pillowed against the fulness of her breast, lay a little child.",the sane woman seemed etr e for wath the man was not ter the herars i tie dark head e gitst the fomess the breast tey e e,0.709677419,0.411290323,0.6875,0.884792627,0.115207373
task_2_level_3_clean_107.wav,"I had my crowbar in one hand, and the other hand played with the matches in my pocket.",i had et to i on e han he other hands they o matches pocket,0.722222222,0.432835821,0.722222222,0.907407407,0.092592593
task_2_level_3_clean_108.wav,Then I looked at my watch.,then i in to my watch,0.333333333,0.4,0.333333333,0.555555556,0.444444444
task_2_level_3_clean_109.wav,I never could have supposed it.,i never col esippose with ,0.666666667,0.32,0.666666667,0.866666667,0.133333333
task_2_level_3_clean_110.wav,She was turning to go as he woke up.,she was turning to gos a ole god,0.555555556,0.296296296,0.555555556,0.777777778,0.222222222
task_2_level_3_clean_111.wav,I am authorized to make invitations.,i a ofe is to inetations,0.833333333,0.5,0.714285714,0.888888889,0.111111111
task_2_level_3_clean_112.wav,You do not know how many candidates there always are for the first situations.,yeu do now howon an tha oys are os a situcations,0.857142857,0.5,0.857142857,0.974025974,0.025974026
task_2_level_3_clean_113.wav,"But IF you cared, he said, speaking very low, that is how you would care?",bet is she care he said  spite hary lon at s her can,0.866666667,0.527272727,0.866666667,0.979487179,0.020512821
task_2_level_3_clean_114.wav,I was extremely taken aback and I believe spoke to her for the first time in my life.,i was extremely taken aback and everli sboto e first onin my light ,0.555555556,0.358208955,0.555555556,0.726495726,0.273504274
task_2_level_3_clean_115.wav,She wanted to run to it and play with it.,she wanted to run to he play in,0.4,0.322580645,0.4,0.55,0.45
task_2_level_3_clean_116.wav,I saw you first in February.,i saw you norse on herword,0.5,0.409090909,0.5,0.75,0.25
task_2_level_3_clean_117.wav,"Ah, said the doctor, I see.",passi o to herse,1,0.631578947,1,1,0
task_2_level_3_clean_118.wav,He was driven to use the prerogatives of his profession.,it was driver in te as lit tl robins os prefussion,1,0.5,0.909090909,0.990909091,0.009090909
task_2_level_3_clean_119.wav,Let him go to his own place.,let hin go to his om place,0.285714286,0.142857143,0.285714286,0.489795918,0.510204082
task_2_level_3_clean_120.wav,With the latchkey I opened the door of refuge.,the last on pale en e tor brecoish,0.888888889,0.675675676,0.888888889,0.986111111,0.013888889
task_2_level_3_clean_121.wav,A tap came at her door.,a tal cu reper doon,0.833333333,0.411764706,0.833333333,0.966666667,0.033333333
task_2_level_3_clean_122.wav,"I thought I did, she said innocently.",ai t she said anysinly,0.714285714,0.586206897,0.714285714,0.885714286,0.114285714
task_2_level_3_clean_123.wav,I faced her a moment with a sad smile.,a base o e sass,0.888888889,0.75862069,0.888888889,0.977777778,0.022222222
task_2_level_3_clean_124.wav,The gay robes of the beautiful people moved hither and thither among the trees.,the ganrars etiful with e dee ma andie tres,0.928571429,0.6,0.928571429,0.992063492,0.007936508
task_2_level_3_clean_125.wav,"He said I am an educated man, but I know her people, all peasants.", said i am enducated but i know e all as is,0.571428571,0.4,0.571428571,0.766233766,0.233766234
task_2_level_3_clean_126.wav,It seemed as if every thing united to promise the most interesting consequences.,it seen as if ever win e nighted to pase thomst interesting cossibencs,0.692307692,0.313432836,0.642857143,0.852071006,0.147928994
task_2_level_3_clean_127.wav,I am conscious of the presence of the woman I love.,i oncious ta e presence of heomen i ton,0.636363636,0.325,0.636363636,0.838383838,0.161616162
task_2_level_3_clean_128.wav,With her it may have been different.,with her it may have beendifferent,0.285714286,0,0.285714286,0.404761905,0.595238095
task_2_level_3_clean_129.wav,But you must have found it very damp and dirty.,ut you must ave none very dan der,0.7,0.378378378,0.7,0.8875,0.1125
task_2_level_3_clean_130.wav,But luckily at the end of the two months they sent him away from home for good.,he lockoly a theend of the two months they sent him away from e god,0.470588235,0.209677419,0.470588235,0.682352941,0.317647059
task_2_level_3_clean_131.wav,But you must give me your calm attention.,but i mustn't give me o calltetion,0.625,0.393939394,0.555555556,0.75,0.25
task_2_level_3_clean_132.wav,"The male pursued the female, flinging flowers at her as he ran.",the man wa sumed e eld e i ours at her as e re,0.833333333,0.52,0.714285714,0.904761905,0.095238095
task_2_level_3_clean_133.wav,I was abandoned to myself now and it was terrible.,i was a pandin to himself thet was terrible,0.6,0.35,0.545454545,0.722222222,0.277777778
task_2_level_3_clean_134.wav,The moon was on the wane each night there was a longer interval of darkness.,the mo was on away he should a e gers on long erentea the darkes,0.8,0.475409836,0.8,0.96,0.04
task_2_level_3_clean_135.wav,Not if you fall into the fountain!,not as his wellns a fon,0.857142857,0.666666667,0.857142857,0.976190476,0.023809524
task_2_level_3_clean_136.wav,"But the great difficulty is this, interrupted the Psychologist.",but the greatest of qoltiis this interrutif the sychatist,0.555555556,0.301886792,0.555555556,0.802469136,0.197530864
task_2_level_3_clean_137.wav,He stepped quickly forward and kissed her.,he stapped it e forwar  kissed her,0.571428571,0.314285714,0.571428571,0.816326531,0.183673469
task_2_level_3_clean_138.wav,"He might better have revelled in the luxury of some artificial fingers for his left hand, which was absolutely fingerless, but it seemed to cause him no inconvenience, and he was satisfied with his wax ears.",he might have better her ron e lashe e soe hotifishon feelers in his lett ha which was absolutely inglous but it seemed to carse if e meri eens and he a satsfied it his bax as,0.666666667,0.398809524,0.631578947,0.852852853,0.147147147
task_2_level_3_clean_139.wav,"And of course I was uncomfortable, too.",and of course i was on comorable to,0.428571429,0.129032258,0.375,0.553571429,0.446428571
task_2_level_3_clean_140.wav,I had no convenient cicerone in the pattern of the Utopian books.,i had been done to meien sis rom o at onto e was,0.916666667,0.660377358,0.846153846,0.974358974,0.025641026
