Filename,Original Text,Transcribed Text,WER,CER,MER,WIL,WIP
task_1_level_4_clean_284.wav,"I thought I would make a virtue of necessity, and see the sunrise.",i thought i would make a birt yo of mesufity and e the sun le,0.461538462,0.25,0.4,0.584615385,0.415384615
task_1_level_4_clean_285.wav,"She wished him very well but he gave her pain, and his welfare twenty miles off would administer most satisfaction.",e with them very well but i dive a pain and as well fare twenty miles off with a minister most satis facton,0.7,0.234042553,0.608695652,0.823913043,0.176086957
task_1_level_4_clean_286.wav,"I mean, would you have wished to paint her?", e have wished the painter,0.777777778,0.454545455,0.777777778,0.911111111,0.088888889
task_1_level_4_clean_287.wav,"In a few moments, all had disappeared.",an a few moments all had difepeared,0.285714286,0.133333333,0.285714286,0.489795918,0.510204082
task_1_level_4_clean_288.wav,"Ah, and how appropriate for us on this day, of all days.",ah how propria for i found is day a,0.666666667,0.476190476,0.666666667,0.851851852,0.148148148
task_1_level_4_clean_289.wav,"I am afraid it has been a bothersome business, he said gently.",i am aflaid had been a bote an biner sadin,0.666666667,0.448979592,0.666666667,0.866666667,0.133333333
task_1_level_4_clean_290.wav,"And thus they started down through the wood, on that lovely Sabbath morn of early summer and the doctor walked erect between those two severed hearts, uniting, and yet dividing them.",and that wo by hed down to the wad a m lovely sabe morin o erly somer and the bocgo walked e rocked the trim ose te sofer heart ye miter and let he by ther ten,0.935483871,0.445945946,0.783783784,0.944202267,0.055797733
task_1_level_4_clean_291.wav,"The yoke snapped with a twang, and they lumbered off together.",the yok a the pwan n  lumbared off together,0.636363636,0.38,0.636363636,0.838383838,0.161616162
task_1_level_4_clean_292.wav,What are you mumbling to yourself?,what ave you mumbr tol,0.666666667,0.428571429,0.666666667,0.866666667,0.133333333
task_1_level_4_clean_293.wav,The feeling soon passed it was unlike her to have entertained anything so subtle., fin passe it was unlike her to had intertained anything so subtle,0.428571429,0.223880597,0.428571429,0.619047619,0.380952381
task_1_level_4_clean_294.wav,In one point she was fully justified.,in one point e fuly doct fie,0.571428571,0.366666667,0.571428571,0.816326531,0.183673469
task_1_level_4_clean_295.wav,At midnight the wagon passes here that is to take us within the boundaries of that marvelous country., midnight the wagon paspid fear that it te pak u within the boundar of that marvelest country,0.5,0.228915663,0.5,0.735294118,0.264705882
task_1_level_4_clean_296.wav,"The necessary roar ensued, and then they drove off.",the netatery ron  eoba,0.888888889,0.682926829,0.888888889,0.972222222,0.027777778
task_1_level_4_clean_297.wav,I could not even satisfy myself whether or not she breathed.,a could not even thatify myself whether or not to bre,0.363636364,0.244897959,0.363636364,0.595041322,0.404958678
task_1_level_4_clean_298.wav,Now there is a cloud coming to cover that moon.,now there is a cloud coming  cover that moon,0.1,0.054054054,0.1,0.1,0.9
task_1_level_4_clean_299.wav,I merely throw it out as a suggestion.,i y flowit out i t n,0.75,0.633333333,0.75,0.928571429,0.071428571
task_1_level_4_clean_300.wav,Take him home and bind his wounds.,take hem home and bid it won,0.571428571,0.259259259,0.571428571,0.816326531,0.183673469
task_1_level_4_clean_301.wav,queried the strained voice from the bed.,e boy on the bad,0.857142857,0.757575758,0.857142857,0.971428571,0.028571429
task_1_level_4_clean_302.wav,Some day they will lead you astray.,some day he wo  ta,0.714285714,0.535714286,0.714285714,0.885714286,0.114285714
task_1_level_4_clean_303.wav,"Yes, I venture still to think it.",thet by bet filled te tinet,1,0.68,1,1,0
task_1_level_4_clean_304.wav,"And at others, what a heap of absurdities it is!",and that other what av heet of a todity to da,0.8,0.459459459,0.727272727,0.918181818,0.081818182
task_1_level_4_clean_305.wav,"asked the Marionette, who was beginning to waver and weaken in his good resolutions.",af the malinat wod eenin to waior and a etin an had good retelution,0.785714286,0.434782609,0.733333333,0.918367347,0.081632653
task_1_level_4_clean_306.wav,"The light at the window had nearly failed, and the girl bent low over her work.",the light af the window had breally faled and the girl bought the ow over her work,0.375,0.193548387,0.352941176,0.555147059,0.444852941
task_1_level_4_clean_307.wav,"There was a scraping of chairs on the stone floor, and a rustling as the congregation rose.",there wos a atn of ca on the fa and he raclan of the congregation o,0.529411765,0.438356164,0.529411765,0.764705882,0.235294118
task_1_level_4_clean_308.wav,The minute or two gained by hurrying them is lost in the final results.,i y hi then d in te final edelt,0.857142857,0.666666667,0.857142857,0.968253968,0.031746032
task_1_level_4_clean_309.wav,The next morning they were at the seashore.,the morning they weref te edor,0.625,0.342857143,0.625,0.8125,0.1875
task_1_level_4_clean_310.wav,She heard the door into the lower hall open and close.,had the dooy for moe hole open and clothe,0.727272727,0.441860465,0.727272727,0.909090909,0.090909091
task_1_level_4_clean_311.wav,"I lit a match and went on past the dusty curtains, of which I have told you.",a mit a map and went on past e busk the purton of wi i av told you,0.529411765,0.344827586,0.473684211,0.673202614,0.326797386
task_1_level_4_clean_312.wav,"Well, papa, if this is not encouragement to marry, I do not know what is.",el papot in so met  o er,1,0.745454545,1,1,0
task_1_level_4_clean_313.wav,"No, it shall be of gold and silver with diamond buttons.",no toll be a golden filber wi diming button,0.818181818,0.363636364,0.818181818,0.95959596,0.04040404
task_1_level_4_clean_314.wav,"As he became rational, he ought to have roused himself and shaken off all that was unworthy in their authority.",ecame lagtnil   loud hemself and sek an off al that thed unwordy of in terautorityn,0.9,0.477777778,0.857142857,0.97,0.03
task_1_level_4_clean_315.wav,"No, I want to be really truthful.",no want er,0.714285714,0.68,0.714285714,0.80952381,0.19047619
task_1_level_4_clean_316.wav,"This thing is beyond words altogether, I said.",e bond word ot together a said,0.875,0.459459459,0.875,0.982142857,0.017857143
task_1_level_4_clean_317.wav,"Yes, I too was born among men.",tet i to wal on o men,0.714285714,0.454545455,0.714285714,0.918367347,0.081632653
task_1_level_4_clean_318.wav,And then something happened which almost caused a riot.,a then happed almost caused the wide,0.666666667,0.52173913,0.666666667,0.857142857,0.142857143
task_1_level_4_clean_319.wav,And will you let me play a few of your accompaniments?,and when you et me play a fe of your company,0.363636364,0.302325581,0.363636364,0.595041322,0.404958678
task_1_level_4_clean_320.wav,"The doctor kicked the pine log, and the flames darted up merrily.",the doctor totk the pine log and a flamed darted up marily,0.333333333,0.211538462,0.333333333,0.555555556,0.444444444
task_1_level_4_clean_321.wav,I shall have to look again some other day.,i sholl have to look at don an mother dad,0.666666667,0.242424242,0.6,0.822222222,0.177777778
task_1_level_4_clean_322.wav,I am not certain about the stupidity.,i am not coting about the bepitity,0.285714286,0.266666667,0.285714286,0.489795918,0.510204082
task_1_level_4_clean_323.wav,"They have their positions, their families to go back to but we are different.",ther had thet the viffe the family to go backtry but we are different,0.642857143,0.322580645,0.6,0.816326531,0.183673469
task_1_level_4_clean_324.wav,As I had no matches on me I waited for a while in the dark.,although ho   wile in the d,0.866666667,0.659090909,0.866666667,0.955555556,0.044444444
task_1_level_4_clean_325.wav,"Two or three white peacocks picked their way across the lawns, and a drab coloured pigeon sat so motionless on the arm of one of the Fates, that it seemed to be a part of the sculptured stone.",whe wold ree white petock a their way across the lawn and a drab colored piding that fo motionless on the arm of one of the face but it cemed to be a part of thi sculpture ton,0.394736842,0.231788079,0.394736842,0.63365651,0.36634349
task_1_level_4_clean_326.wav,But I am not afraid of your seeing what he writes.,but iam not afraid of yor fe what ye right,0.545454545,0.282051282,0.545454545,0.772727273,0.227272727
task_1_level_4_clean_327.wav,I had no doubt that the man knew of her being there but he only knew it by hearsay.,od no doubt that the man knew of her bon ther t the only new af i fis tat,0.578947368,0.3125,0.55,0.775623269,0.224376731
task_1_level_4_clean_328.wav,I fancy I am rather a favourite he took notice of my gown.,i fant the i nota favrt  noiof my down,0.846153846,0.522727273,0.785714286,0.923076923,0.076923077
task_1_level_4_clean_329.wav,"I know, I know, I know!",a mow i know i know,0.333333333,0.2,0.333333333,0.555555556,0.444444444
task_1_level_4_clean_330.wav,What are you doing stretched out on the ground?, that bowt on the ground,0.666666667,0.578947368,0.666666667,0.8,0.2
task_1_level_4_clean_331.wav,But I had no sooner spoken than I caught myself up.,but i had no tin oken that i caught my self up,0.454545455,0.2,0.416666667,0.628787879,0.371212121
task_1_level_4_clean_332.wav,"Do you, in the first place, mind her breaking with Vyse?",me on the first place mind har writ in at bice,0.727272727,0.395348837,0.666666667,0.867768595,0.132231405
task_1_level_4_clean_333.wav,My mother and my cousin have gone.,my mother and my cusin had gone,0.285714286,0.111111111,0.285714286,0.489795918,0.510204082
task_1_level_4_clean_334.wav,They seldom keep their exploits to themselves.,fldom teek e ap tlit to themselves,0.714285714,0.435897436,0.714285714,0.918367347,0.081632653
task_1_level_4_clean_335.wav,The acquaintance she had already formed were unworthy of her.,e a quorent fe a omity formed were unwotines her,0.8,0.490196078,0.727272727,0.91,0.09
task_1_level_4_clean_336.wav,I have never seen anything like that.,i have never see anything like that,0.142857143,0.033333333,0.142857143,0.265306122,0.734693878
task_1_level_4_clean_337.wav,"said the mother, and the conversation lagged.",but the mother and the compersation alowed,0.428571429,0.27027027,0.428571429,0.673469388,0.326530612
task_1_level_4_clean_338.wav,But for its elasticity it might have been frozen.,but bi elafted tety but might have been fopen,0.555555556,0.35,0.555555556,0.802469136,0.197530864
task_1_level_4_clean_339.wav,And what a horrible night it was!,and what a horrible night it wiy,0.142857143,0.076923077,0.142857143,0.265306122,0.734693878
task_1_level_4_clean_340.wav,Then another sound broke upon my ears like the raising of a window sash.,ten another found bug upon my dears by the raving of a window back,0.5,0.275862069,0.5,0.75,0.25
task_1_level_4_clean_341.wav,"By the way, I was quite unprepared to find him such a character.",by the way i wosd quite unprepared to find himself e carser,0.384615385,0.2,0.384615385,0.58974359,0.41025641
task_1_level_4_clean_342.wav,That day she carried no barbarous arrow in her hair.,that dayed no ,0.8,0.738095238,0.8,0.866666667,0.133333333
task_1_level_4_clean_343.wav,He listened for a few moments and heard nothing.,in fe momen ad nothing,0.888888889,0.538461538,0.888888889,0.977777778,0.022222222
task_1_level_4_clean_344.wav,This was too true for contradiction., ,1,1,1,1,0
task_1_level_4_clean_345.wav,Did he put that to you as a justification?,he po ot yo or the beskf o tation,1,0.606060606,1,1,0
task_1_level_4_clean_346.wav,Then she took up the paper and opened it.,don' te took up the paper opened et,0.444444444,0.28125,0.444444444,0.652777778,0.347222222
task_1_level_4_clean_347.wav,"Never, truly, had a person turned out shown so little to explain it as this little person!",never te ot a person toned out son so little to slain a thesi person,0.529411765,0.323943662,0.529411765,0.749019608,0.250980392
task_1_level_4_clean_348.wav,"But they answered the call from habit and some of them were lame from the traps they had fallen into, and some limped from shot wounds, and some were mangy from eating bad food, and many were missing.",a a cofin habit and some of them were lon from the trop foad valin into and some looed from socteing and some one ton i fome eaing bob trouh a on mesin,0.631578947,0.465408805,0.631578947,0.843700159,0.156299841
task_1_level_4_clean_349.wav,"This was the man who, bowing his dark head towards the crucifixion window, said I accept the cross.",hi i the man he bowing his do had toward the cruf of e tanno t the cross,0.611111111,0.405063291,0.611111111,0.848765432,0.151234568
task_1_level_4_clean_350.wav,But at my first gesture towards this they behaved very oddly.,but at my first dester towards this the behase very odjes,0.363636364,0.18,0.363636364,0.595041322,0.404958678
task_1_level_4_clean_351.wav,"she was as grateful as possible, you may be sure.", wi a groat fol of passible ,1,0.631578947,1,1,0
task_1_level_4_clean_352.wav,"Well, take off the bandage and look, said the doctor.",well ta op the bend in look said the doctor,0.4,0.243902439,0.4,0.64,0.36
task_1_level_4_clean_353.wav,I caught up my coat left my hat and bag.,a cougt upt my poase last my fratin bad,0.8,0.466666667,0.8,0.955555556,0.044444444
task_1_level_4_clean_354.wav,"Even to tears, I said provokingly.", a,1,0.962962963,1,1,0
task_1_level_4_clean_355.wav,Do you find such sayings in your books?,iind he in e book,0.875,0.677419355,0.875,0.975,0.025
task_1_level_4_clean_356.wav,"It must, if I were not here.",it mut y l not,0.714285714,0.6,0.714285714,0.885714286,0.114285714
task_1_level_4_clean_357.wav,"She kept her eyes on me, and repeated with a sort of whimsical enviousness  The sea!",put yor eye gon and ed with ot of wind icl un,0.8125,0.590909091,0.8125,0.953125,0.046875
task_1_level_4_clean_358.wav,What to my backward glance seems startling and a little awful is their punctualness and inevitability.,what o my back would glance i sdartling and a wittle awful te ther park r an es a e ovetability,0.9375,0.313953488,0.714285714,0.892857143,0.107142857
task_1_level_4_clean_359.wav,"Its population, large though it was, was composed wholly of boys.",at population lie elat wise wit compose toly a boy,0.909090909,0.442307692,0.909090909,0.990909091,0.009090909
task_1_level_4_clean_360.wav,What was wrong with that silence?,hat w long wi,1,0.666666667,1,1,0
task_1_level_4_clean_361.wav,I had a bizarre notion that he was not to be disturbed.,i had a begard noton that he would not to be te tod,0.416666667,0.372093023,0.384615385,0.58974359,0.41025641
task_1_level_4_clean_362.wav,Are you sure we are alone?,i il n,1,0.9,1,1,0
task_1_level_4_clean_363.wav,"In that very room she had been measured last September, with her two friends.",en that very room the ad been megered laugh that tember it he tee friend,0.785714286,0.290322581,0.733333333,0.923809524,0.076190476
task_1_level_4_clean_364.wav,I do not know how long I sat peering down that well.,a do not now how long i geft paing down that well,0.333333333,0.2,0.333333333,0.555555556,0.444444444
task_1_level_4_clean_365.wav,"You can direct me in most things, but not in this.",ind e most a bunot ie,0.909090909,0.657894737,0.909090909,0.984848485,0.015151515
task_1_level_4_clean_366.wav,They want to get to them.,the want e et for them,0.666666667,0.315789474,0.666666667,0.888888889,0.111111111
task_1_level_4_clean_367.wav,"The sense of manhood and mastery the right of control, the joy of possession, arose within him.",e thent of man who had in mashed e the right of control hejoy of posdession a rol as tithin him,0.882352941,0.25,0.714285714,0.899159664,0.100840336
task_1_level_4_clean_368.wav,The hands spun backward upon the dials.,the hand fun backward upon the bile,0.428571429,0.1875,0.428571429,0.673469388,0.326530612
task_1_level_4_clean_369.wav,She even answered my question quite readily with many words out of which I could make very little.,even intod my question quite ratherly if mony words how of wich i could make very little,0.388888889,0.275,0.388888889,0.604575163,0.395424837
task_1_level_4_clean_370.wav,The darkness presently fell from my eyes.,the but of probely foldsom moler,0.857142857,0.588235294,0.857142857,0.976190476,0.023809524
task_1_level_4_clean_371.wav,"He looked at me curiously, with that same searching glance which I hate and fear so in doctors.",e lo te ot ten festin gon forbo hisin fear so an doctor,0.888888889,0.605263158,0.888888889,0.982905983,0.017094017
task_1_level_4_clean_372.wav,"We were soon seated together in a little stone arbour, engaged in conversation, chiefly of smiles.",e would  i comeaon,1,0.85,1,1,0
task_1_level_4_clean_373.wav,A horrid mistrust of the whole house possessed me.,a hard me u at the whole house to gotlen,0.666666667,0.463414634,0.6,0.822222222,0.177777778
task_1_level_4_clean_374.wav,"Did you really tell him to get out and never come near you again, or something awful like that?",he really fell in to get out and never come near you again ut something awful like that,0.263157895,0.146666667,0.263157895,0.426900585,0.573099415
task_1_level_4_clean_375.wav,They were looking over views in Swisserland.,they were looking ove an wiand,0.571428571,0.351351351,0.571428571,0.785714286,0.214285714
task_1_level_4_clean_376.wav,"I, too, she said with a sort of funny eagerness.",i can sad wtheo bune,0.9,0.694444444,0.9,0.98,0.02
task_1_level_4_clean_377.wav,I shall have to send to town.,i thoul hav to send o town,0.428571429,0.227272727,0.428571429,0.673469388,0.326530612
task_1_level_4_clean_378.wav,"Then she asked me in her soft quaint accent how I had passed the night, and whether I was very much inconvenienced by wearing the clothes which old Pelagie had put there for me while I slept.",then heas her thought qoint atsent how i passed the man and whether i was very much intovenious by wearing a closed with old palar gy had put theire fror me while i slept,0.459459459,0.294117647,0.447368421,0.649443561,0.350556439
task_1_level_4_clean_379.wav,Faces grew more distinct among the marching masses and he recognized one.,fay good more on the mark in mater and he racadgized one,0.666666667,0.442622951,0.666666667,0.888888889,0.111111111
task_1_level_4_clean_380.wav,He is taking his meal with the others.,e ,1,0.966666667,1,1,0
task_1_level_4_clean_381.wav,And then it came into my head that I would amaze our friends behind by lighting it.,a nont a pemen mo hard ta i would amove y fund te hand bi lih e net,1,0.5,0.894736842,0.986928105,0.013071895
task_1_level_4_clean_382.wav,"Your one possible course would be to collapse into the mud, and let the ducal gouties trample on you.",the one parsible qort whold be the collapse into the mud and left the dukle goubtes ample on oin,0.526315789,0.308641975,0.526315789,0.775623269,0.224376731
task_1_level_4_clean_383.wav,"She was his object, and every body must perceive it.",he wit is object and everybody must have beenet,0.7,0.292682927,0.7,0.9,0.1
task_1_level_4_clean_384.wav,I left him three days ago on the shore of a large sea.,i left him through ther abol on the shore of a lod an,0.384615385,0.414634146,0.384615385,0.621301775,0.378698225
task_1_level_4_clean_385.wav,He who steals grapes may very easily steal chickens also.,u e ma ve e e en doner,1,0.808510638,1,1,0
task_1_level_4_clean_386.wav,"A glorious September sun blazed down upon the water, there was absolute silence up and down the curving shore.",a bloy a tember ton bla bown u on the wader therh it aptol sienc ufan down the cabin shore,0.842105263,0.377777778,0.761904762,0.934210526,0.065789474
task_1_level_4_clean_387.wav,"Possibly he does know, for I refer to Lorenzo the poet.",possibly he bagd nown fi e ferc an e men o the polet,0.909090909,0.372093023,0.769230769,0.937062937,0.062937063
task_1_level_4_clean_388.wav,"I went back to the studio, and resumed my work.",i went back to the studio and wasined my work,0.1,0.111111111,0.1,0.19,0.81
task_1_level_4_clean_389.wav,"So you do love me, little thing?",  little tin,0.857142857,0.625,0.857142857,0.928571429,0.071428571
task_1_level_4_clean_390.wav,I went eagerly to every unbroken case.,i went in really  every unboking case,0.428571429,0.322580645,0.428571429,0.673469388,0.326530612
task_1_level_4_clean_391.wav,The woods had opened to leave space for a sloping triangular meadow.,the wood put opened o e bot bor sloping solnd a moto,0.833333333,0.5,0.833333333,0.972222222,0.027777778
task_1_level_4_clean_392.wav,"Heaps of people can sing a little, but very few can accompany properly.",u people canfa lil but ver fo i company populy,0.846153846,0.438596491,0.846153846,0.969230769,0.030769231
task_1_level_4_clean_393.wav,"No.  Bribes were out of the question, he admitted.",no wa wiout of the question wod miter,0.555555556,0.368421053,0.555555556,0.777777778,0.222222222
task_1_level_4_clean_394.wav,His long nose became at least two inches longer., blond more become ale e an fo ander,1,0.564102564,1,1,0
task_1_level_4_clean_395.wav,"He chanced to be in a lucid critical mood, and would not sympathize with exaltation.",the plant t be in a lefod critical mood and would not tomtafize that ex otison,0.533333333,0.352941176,0.5,0.733333333,0.266666667
task_1_level_4_clean_396.wav,"Apparently the single house, and possibly even the household, had vanished.",appaently te fingle house and passibly even the household had banished,0.454545455,0.080645161,0.454545455,0.702479339,0.297520661
task_1_level_4_clean_397.wav,They were never importunate and yet never listless.,they weuld never import in it and yet never mifly,0.625,0.279069767,0.5,0.6875,0.3125
task_1_level_4_clean_398.wav,No one has come out this way.,no one id come out the say,0.428571429,0.227272727,0.428571429,0.673469388,0.326530612
task_1_level_4_clean_399.wav,I saw one little thing that seemed odd to me.,a bau one little thing t o,0.7,0.514285714,0.7,0.871428571,0.128571429
task_1_level_4_clean_400.wav,"However, when I read on, I found it was not near so bad as I had fancied at first and I make so light of it now to her, that she does not think much about it.",hiever when i wo on i founded  not mer o bout abo fa  first and i make so light of it now e her ut  id not think mych about it,0.486486486,0.347457627,0.486486486,0.685265911,0.314734089
task_1_level_4_clean_401.wav,This is a poor reward for following thee twenty miles., is the poor reward the following the twenty miles,0.4,0.204545455,0.4,0.6,0.4
task_1_level_4_clean_402.wav,That part of it represented by the fabulous collections was still being protected by the police.,that part of it letedented by the fabuous collection with til beng protected by the pen,0.4375,0.2,0.4375,0.68359375,0.31640625
task_1_level_4_clean_403.wav,I have never seen you in such a mood.,i have never seen ye eemon,0.555555556,0.392857143,0.555555556,0.703703704,0.296296296
task_1_level_4_clean_404.wav,"We are waiting, was the reply.",war waiting wak em reppli,0.833333333,0.347826087,0.833333333,0.966666667,0.033333333
task_1_level_4_clean_405.wav,A cloud passed before the sun.,a cloud path before the sun,0.166666667,0.166666667,0.166666667,0.305555556,0.694444444
task_1_level_4_clean_406.wav,"I, of course, could not share his consternation.",i of courte could not fear hi comfinaton,0.5,0.289473684,0.5,0.75,0.25
task_1_level_4_clean_407.wav,It is the greatest amusement in the world!,the greatet te museent in the world,0.625,0.205882353,0.625,0.839285714,0.160714286
task_1_level_4_clean_408.wav,"Remember, Mother, it is always the seventh wave that goes farthest up the beach.",a monher mother in id always be suvent tway that gos by the stuff the beast,0.857142857,0.328125,0.75,0.928571429,0.071428571
task_1_level_4_clean_409.wav,"Waiting, he replied, in accents of adoration.",wildin he replied an accant to thatteraon,0.714285714,0.388888889,0.714285714,0.918367347,0.081632653
task_1_level_4_clean_410.wav,"I knew that something strange had happened, and for the moment could not distinguish what the strange thing might be.",a new that something stlaing ta happened and for the moment did not distinguish what the strang thing might do,0.35,0.145833333,0.35,0.5775,0.4225
task_1_level_4_clean_411.wav,"Well, pretty good news, is not it?",well put a good me if not it,0.571428571,0.32,0.5,0.714285714,0.285714286
task_1_level_4_clean_412.wav,The public pays and must be served well.,the public pay and muct be ter well,0.375,0.1875,0.375,0.609375,0.390625
task_1_level_4_clean_413.wav,"Why yes, but he is going to have a tough time when some of his illusions are dispelled.",why  ha qus tien and some of the dalisions a de soud,0.888888889,0.632352941,0.842105263,0.958333333,0.041666667
task_1_level_4_clean_414.wav,"Some took a nibble, some took a bite, but no sooner had they tasted a page or two, than they spat them out with a wry face, as if to say  What a horrid taste!",some thinible some to the bite but no son had been caced to the paber to an thi stap ham out with a rive boce af i tetane what ar horide case,0.714285714,0.423728814,0.714285714,0.910714286,0.089285714
task_1_level_4_clean_415.wav,"I long to make apologies, excuses, to urge something for myself.",a long to make a pologus ,0.727272727,0.647058824,0.727272727,0.863636364,0.136363636
task_1_level_4_clean_416.wav,My fire would not need replenishing for an hour or so.,my fire would not ev replii an for an hour so,0.363636364,0.255813953,0.333333333,0.47107438,0.52892562
task_1_level_4_clean_417.wav,"Nothing can be more simple, you see.",nothing cand be more simple youe,0.428571429,0.107142857,0.428571429,0.619047619,0.380952381
